[I 2025-07-10 22:11:58,184] Trial 46 finished with value: 0.6130420749304205 and parameters: {'n_components': 3, 'scaler_type': 'PowerTransformer'}. Best is trial 15 with value: 0.705171103882979.
[I 2025-07-10 22:12:13,544] Trial 47 finished with value: 0.7051711038789341 and parameters: {'n_components': 2, 'scaler_type': 'RobustScaler'}. Best is trial 15 with value: 0.705171103882979.
[I 2025-07-10 22:12:28,960] Trial 48 finished with value: 0.7051711038804095 and parameters: {'n_components': 2, 'scaler_type': 'RobustScaler'}. Best is trial 15 with value: 0.705171103882979.
[I 2025-07-10 22:12:42,914] Trial 49 finished with value: 0.5430513399787755 and parameters: {'n_components': 4, 'scaler_type': 'MinMaxScaler'}. Best is trial 15 with value: 0.705171103882979.
[I 2025-07-10 22:12:58,298] Trial 50 finished with value: 0.6725767926498996 and parameters: {'n_components': 3, 'scaler_type': 'RobustScaler'}. Best is trial 15 with value: 0.705171103882979.
[I 2025-07-10 22:13:13,751] Trial 51 finished with value: 0.7051711038813985 and parameters: {'n_components': 2, 'scaler_type': 'RobustScaler'}. Best is trial 15 with value: 0.705171103882979.
[I 2025-07-10 22:13:29,192] Trial 52 finished with value: 0.7051711038811159 and parameters: {'n_components': 2, 'scaler_type': 'RobustScaler'}. Best is trial 15 with value: 0.705171103882979.
[I 2025-07-10 22:13:44,436] Trial 53 finished with value: 0.7051711038793752 and parameters: {'n_components': 2, 'scaler_type': 'RobustScaler'}. Best is trial 15 with value: 0.705171103882979.
/home/garrett_reinhard_afrl_af_mil/miniconda3/envs/Ising/lib/python3.13/site-packages/numpy/_core/_methods.py:193: RuntimeWarning: overflow encountered in multiply
  x = um.multiply(x, x, out=x)
/home/garrett_reinhard_afrl_af_mil/miniconda3/envs/Ising/lib/python3.13/site-packages/numpy/_core/_methods.py:204: RuntimeWarning: overflow encountered in reduce
  ret = umr_sum(x, axis, dtype, out, keepdims=keepdims, where=where)
[I 2025-07-10 22:14:05,481] Trial 54 finished with value: 0.6456071913208401 and parameters: {'n_components': 2, 'scaler_type': 'PowerTransformer'}. Best is trial 15 with value: 0.705171103882979.
[I 2025-07-10 22:14:20,777] Trial 55 finished with value: 0.7051711038797068 and parameters: {'n_components': 2, 'scaler_type': 'RobustScaler'}. Best is trial 15 with value: 0.705171103882979.
[I 2025-07-10 22:14:34,934] Trial 56 finished with value: 0.5737014253081298 and parameters: {'n_components': 2, 'scaler_type': 'MaxAbsScaler'}. Best is trial 15 with value: 0.705171103882979.
[I 2025-07-10 22:14:50,152] Trial 57 finished with value: 0.7051711038807478 and parameters: {'n_components': 2, 'scaler_type': 'RobustScaler'}. Best is trial 15 with value: 0.705171103882979.
[I 2025-07-10 22:15:05,548] Trial 58 finished with value: 0.6725767929573092 and parameters: {'n_components': 3, 'scaler_type': 'RobustScaler'}. Best is trial 15 with value: 0.705171103882979.
[I 2025-07-10 22:15:20,820] Trial 59 finished with value: 0.7051711038805311 and parameters: {'n_components': 2, 'scaler_type': 'RobustScaler'}. Best is trial 15 with value: 0.705171103882979.
[I 2025-07-10 22:15:34,913] Trial 60 finished with value: 0.5647139483281862 and parameters: {'n_components': 3, 'scaler_type': 'MinMaxScaler'}. Best is trial 15 with value: 0.705171103882979.
[I 2025-07-10 22:15:50,251] Trial 61 finished with value: 0.7051711038802132 and parameters: {'n_components': 2, 'scaler_type': 'RobustScaler'}. Best is trial 15 with value: 0.705171103882979.
[I 2025-07-10 22:16:05,514] Trial 62 finished with value: 0.7051711038834149 and parameters: {'n_components': 2, 'scaler_type': 'RobustScaler'}. Best is trial 62 with value: 0.7051711038834149.
[I 2025-07-10 22:16:20,945] Trial 63 finished with value: 0.7051711038822225 and parameters: {'n_components': 2, 'scaler_type': 'RobustScaler'}. Best is trial 62 with value: 0.7051711038834149.
[I 2025-07-10 22:16:36,326] Trial 64 finished with value: 0.7051711038808888 and parameters: {'n_components': 2, 'scaler_type': 'RobustScaler'}. Best is trial 62 with value: 0.7051711038834149.
[I 2025-07-10 22:16:51,810] Trial 65 finished with value: 0.6259390971009237 and parameters: {'n_components': 5, 'scaler_type': 'RobustScaler'}. Best is trial 62 with value: 0.7051711038834149.
/home/garrett_reinhard_afrl_af_mil/miniconda3/envs/Ising/lib/python3.13/site-packages/numpy/_core/_methods.py:193: RuntimeWarning: overflow encountered in multiply
  x = um.multiply(x, x, out=x)
/home/garrett_reinhard_afrl_af_mil/miniconda3/envs/Ising/lib/python3.13/site-packages/numpy/_core/_methods.py:204: RuntimeWarning: overflow encountered in reduce
  ret = umr_sum(x, axis, dtype, out, keepdims=keepdims, where=where)
[I 2025-07-10 22:17:12,868] Trial 66 finished with value: 0.6456071913220175 and parameters: {'n_components': 2, 'scaler_type': 'PowerTransformer'}. Best is trial 62 with value: 0.7051711038834149.
[I 2025-07-10 22:17:28,204] Trial 67 finished with value: 0.7051711038807745 and parameters: {'n_components': 2, 'scaler_type': 'RobustScaler'}. Best is trial 62 with value: 0.7051711038834149.
[I 2025-07-10 22:17:43,539] Trial 68 finished with value: 0.7051711038805455 and parameters: {'n_components': 2, 'scaler_type': 'RobustScaler'}. Best is trial 62 with value: 0.7051711038834149.
[I 2025-07-10 22:17:57,562] Trial 69 finished with value: 0.5737014253066054 and parameters: {'n_components': 2, 'scaler_type': 'MaxAbsScaler'}. Best is trial 62 with value: 0.7051711038834149.
[I 2025-07-10 22:18:12,821] Trial 70 finished with value: 0.7051711038803371 and parameters: {'n_components': 2, 'scaler_type': 'RobustScaler'}. Best is trial 62 with value: 0.7051711038834149.
[I 2025-07-10 22:18:28,178] Trial 71 finished with value: 0.7051711038788928 and parameters: {'n_components': 2, 'scaler_type': 'RobustScaler'}. Best is trial 62 with value: 0.7051711038834149.
[I 2025-07-10 22:18:43,500] Trial 72 finished with value: 0.7051711038796027 and parameters: {'n_components': 2, 'scaler_type': 'RobustScaler'}. Best is trial 62 with value: 0.7051711038834149.
[I 2025-07-10 22:18:58,784] Trial 73 finished with value: 0.7051711038807194 and parameters: {'n_components': 2, 'scaler_type': 'RobustScaler'}. Best is trial 62 with value: 0.7051711038834149.
[I 2025-07-10 22:19:14,132] Trial 74 finished with value: 0.705171103876931 and parameters: {'n_components': 2, 'scaler_type': 'RobustScaler'}. Best is trial 62 with value: 0.7051711038834149.
[I 2025-07-10 22:19:30,346] A new study created in memory with name: pca_kmeans_optimization
[I 2025-07-10 22:19:44,574] Trial 0 finished with value: 0.7755014919527182 and parameters: {'n_components': 2, 'scaler_type': 'StandardScaler'}. Best is trial 0 with value: 0.7755014919527182.
[I 2025-07-10 22:19:58,660] Trial 1 finished with value: 0.6059411492417622 and parameters: {'n_components': 5, 'scaler_type': 'MaxAbsScaler'}. Best is trial 0 with value: 0.7755014919527182.
/home/garrett_reinhard_afrl_af_mil/miniconda3/envs/Ising/lib/python3.13/site-packages/numpy/_core/_methods.py:193: RuntimeWarning: overflow encountered in multiply
  x = um.multiply(x, x, out=x)
/home/garrett_reinhard_afrl_af_mil/miniconda3/envs/Ising/lib/python3.13/site-packages/numpy/_core/_methods.py:204: RuntimeWarning: overflow encountered in reduce
  ret = umr_sum(x, axis, dtype, out, keepdims=keepdims, where=where)
[I 2025-07-10 22:20:15,340] Trial 2 finished with value: 0.60126485760401 and parameters: {'n_components': 5, 'scaler_type': 'PowerTransformer'}. Best is trial 0 with value: 0.7755014919527182.
[I 2025-07-10 22:20:29,635] Trial 3 finished with value: 0.5772078421906567 and parameters: {'n_components': 6, 'scaler_type': 'StandardScaler'}. Best is trial 0 with value: 0.7755014919527182.
[I 2025-07-10 22:20:43,933] Trial 4 finished with value: 0.5772064857781609 and parameters: {'n_components': 6, 'scaler_type': 'StandardScaler'}. Best is trial 0 with value: 0.7755014919527182.
[I 2025-07-10 22:20:57,890] Trial 5 finished with value: 0.5881590492378388 and parameters: {'n_components': 6, 'scaler_type': 'MinMaxScaler'}. Best is trial 0 with value: 0.7755014919527182.
[I 2025-07-10 22:21:11,884] Trial 6 finished with value: 0.588159159579875 and parameters: {'n_components': 6, 'scaler_type': 'MinMaxScaler'}. Best is trial 0 with value: 0.7755014919527182.
[I 2025-07-10 22:21:26,066] Trial 7 finished with value: 0.6059409957005066 and parameters: {'n_components': 5, 'scaler_type': 'MaxAbsScaler'}. Best is trial 0 with value: 0.7755014919527182.
[I 2025-07-10 22:21:40,143] Trial 8 finished with value: 0.6059408086019907 and parameters: {'n_components': 5, 'scaler_type': 'MinMaxScaler'}. Best is trial 0 with value: 0.7755014919527182.
/home/garrett_reinhard_afrl_af_mil/miniconda3/envs/Ising/lib/python3.13/site-packages/numpy/_core/_methods.py:193: RuntimeWarning: overflow encountered in multiply
  x = um.multiply(x, x, out=x)
/home/garrett_reinhard_afrl_af_mil/miniconda3/envs/Ising/lib/python3.13/site-packages/numpy/_core/_methods.py:204: RuntimeWarning: overflow encountered in reduce
  ret = umr_sum(x, axis, dtype, out, keepdims=keepdims, where=where)
[I 2025-07-10 22:21:56,920] Trial 9 finished with value: 0.6012644306295164 and parameters: {'n_components': 5, 'scaler_type': 'PowerTransformer'}. Best is trial 0 with value: 0.7755014919527182.
[I 2025-07-10 22:22:12,237] Trial 10 finished with value: 0.7002571260367803 and parameters: {'n_components': 2, 'scaler_type': 'RobustScaler'}. Best is trial 0 with value: 0.7755014919527182.
[I 2025-07-10 22:22:27,596] Trial 11 finished with value: 0.7002571260619411 and parameters: {'n_components': 2, 'scaler_type': 'RobustScaler'}. Best is trial 0 with value: 0.7755014919527182.
[I 2025-07-10 22:22:42,981] Trial 12 finished with value: 0.7002571260128473 and parameters: {'n_components': 2, 'scaler_type': 'RobustScaler'}. Best is trial 0 with value: 0.7755014919527182.
[I 2025-07-10 22:22:58,252] Trial 13 finished with value: 0.6576365241138751 and parameters: {'n_components': 3, 'scaler_type': 'RobustScaler'}. Best is trial 0 with value: 0.7755014919527182.
[I 2025-07-10 22:23:12,565] Trial 14 finished with value: 0.6473663854143846 and parameters: {'n_components': 3, 'scaler_type': 'StandardScaler'}. Best is trial 0 with value: 0.7755014919527182.
[I 2025-07-10 22:23:27,890] Trial 15 finished with value: 0.6576365247098724 and parameters: {'n_components': 3, 'scaler_type': 'RobustScaler'}. Best is trial 0 with value: 0.7755014919527182.
[I 2025-07-10 22:23:42,056] Trial 16 finished with value: 0.7755014923639735 and parameters: {'n_components': 2, 'scaler_type': 'StandardScaler'}. Best is trial 16 with value: 0.7755014923639735.
[I 2025-07-10 22:23:56,275] Trial 17 finished with value: 0.627904199538087 and parameters: {'n_components': 4, 'scaler_type': 'StandardScaler'}. Best is trial 16 with value: 0.7755014923639735.
[I 2025-07-10 22:24:10,510] Trial 18 finished with value: 0.6473663860405791 and parameters: {'n_components': 3, 'scaler_type': 'StandardScaler'}. Best is trial 16 with value: 0.7755014923639735.
[I 2025-07-10 22:24:24,707] Trial 19 finished with value: 0.7755014916761223 and parameters: {'n_components': 2, 'scaler_type': 'StandardScaler'}. Best is trial 16 with value: 0.7755014923639735.
[I 2025-07-10 22:24:38,881] Trial 20 finished with value: 0.6279038171322306 and parameters: {'n_components': 4, 'scaler_type': 'StandardScaler'}. Best is trial 16 with value: 0.7755014923639735.
[I 2025-07-10 22:24:53,118] Trial 21 finished with value: 0.775501492142012 and parameters: {'n_components': 2, 'scaler_type': 'StandardScaler'}. Best is trial 16 with value: 0.7755014923639735.
[I 2025-07-10 22:25:07,289] Trial 22 finished with value: 0.775501491665776 and parameters: {'n_components': 2, 'scaler_type': 'StandardScaler'}. Best is trial 16 with value: 0.7755014923639735.
[I 2025-07-10 22:25:21,492] Trial 23 finished with value: 0.6473663864592736 and parameters: {'n_components': 3, 'scaler_type': 'StandardScaler'}. Best is trial 16 with value: 0.7755014923639735.
[I 2025-07-10 22:25:35,732] Trial 24 finished with value: 0.7755014921263576 and parameters: {'n_components': 2, 'scaler_type': 'StandardScaler'}. Best is trial 16 with value: 0.7755014923639735.
/home/garrett_reinhard_afrl_af_mil/miniconda3/envs/Ising/lib/python3.13/site-packages/numpy/_core/_methods.py:193: RuntimeWarning: overflow encountered in multiply
  x = um.multiply(x, x, out=x)
/home/garrett_reinhard_afrl_af_mil/miniconda3/envs/Ising/lib/python3.13/site-packages/numpy/_core/_methods.py:204: RuntimeWarning: overflow encountered in reduce
  ret = umr_sum(x, axis, dtype, out, keepdims=keepdims, where=where)
[I 2025-07-10 22:25:52,603] Trial 25 finished with value: 0.7755014922062803 and parameters: {'n_components': 2, 'scaler_type': 'PowerTransformer'}. Best is trial 16 with value: 0.7755014923639735.
/home/garrett_reinhard_afrl_af_mil/miniconda3/envs/Ising/lib/python3.13/site-packages/numpy/_core/_methods.py:193: RuntimeWarning: overflow encountered in multiply
  x = um.multiply(x, x, out=x)
/home/garrett_reinhard_afrl_af_mil/miniconda3/envs/Ising/lib/python3.13/site-packages/numpy/_core/_methods.py:204: RuntimeWarning: overflow encountered in reduce
  ret = umr_sum(x, axis, dtype, out, keepdims=keepdims, where=where)
[I 2025-07-10 22:26:09,393] Trial 26 finished with value: 0.6473663857756644 and parameters: {'n_components': 3, 'scaler_type': 'PowerTransformer'}. Best is trial 16 with value: 0.7755014923639735.
/home/garrett_reinhard_afrl_af_mil/miniconda3/envs/Ising/lib/python3.13/site-packages/numpy/_core/_methods.py:193: RuntimeWarning: overflow encountered in multiply
  x = um.multiply(x, x, out=x)
/home/garrett_reinhard_afrl_af_mil/miniconda3/envs/Ising/lib/python3.13/site-packages/numpy/_core/_methods.py:204: RuntimeWarning: overflow encountered in reduce
  ret = umr_sum(x, axis, dtype, out, keepdims=keepdims, where=where)
[I 2025-07-10 22:26:26,049] Trial 27 finished with value: 0.775501491935104 and parameters: {'n_components': 2, 'scaler_type': 'PowerTransformer'}. Best is trial 16 with value: 0.7755014923639735.
/home/garrett_reinhard_afrl_af_mil/miniconda3/envs/Ising/lib/python3.13/site-packages/numpy/_core/_methods.py:193: RuntimeWarning: overflow encountered in multiply
  x = um.multiply(x, x, out=x)
/home/garrett_reinhard_afrl_af_mil/miniconda3/envs/Ising/lib/python3.13/site-packages/numpy/_core/_methods.py:204: RuntimeWarning: overflow encountered in reduce
  ret = umr_sum(x, axis, dtype, out, keepdims=keepdims, where=where)
[I 2025-07-10 22:26:42,676] Trial 28 finished with value: 0.6279039135475866 and parameters: {'n_components': 4, 'scaler_type': 'PowerTransformer'}. Best is trial 16 with value: 0.7755014923639735.
[I 2025-07-10 22:26:56,782] Trial 29 finished with value: 0.7045180311405606 and parameters: {'n_components': 2, 'scaler_type': 'MaxAbsScaler'}. Best is trial 16 with value: 0.7755014923639735.
/home/garrett_reinhard_afrl_af_mil/miniconda3/envs/Ising/lib/python3.13/site-packages/numpy/_core/_methods.py:193: RuntimeWarning: overflow encountered in multiply
  x = um.multiply(x, x, out=x)
/home/garrett_reinhard_afrl_af_mil/miniconda3/envs/Ising/lib/python3.13/site-packages/numpy/_core/_methods.py:204: RuntimeWarning: overflow encountered in reduce
  ret = umr_sum(x, axis, dtype, out, keepdims=keepdims, where=where)
[I 2025-07-10 22:27:13,534] Trial 30 finished with value: 0.6473663863245653 and parameters: {'n_components': 3, 'scaler_type': 'PowerTransformer'}. Best is trial 16 with value: 0.7755014923639735.
[I 2025-07-10 22:27:27,682] Trial 31 finished with value: 0.7755014902693792 and parameters: {'n_components': 2, 'scaler_type': 'StandardScaler'}. Best is trial 16 with value: 0.7755014923639735.
[I 2025-07-10 22:27:41,823] Trial 32 finished with value: 0.77550149165891 and parameters: {'n_components': 2, 'scaler_type': 'StandardScaler'}. Best is trial 16 with value: 0.7755014923639735.
[I 2025-07-10 22:27:55,976] Trial 33 finished with value: 0.7755014913881139 and parameters: {'n_components': 2, 'scaler_type': 'StandardScaler'}. Best is trial 16 with value: 0.7755014923639735.
[I 2025-07-10 22:28:10,088] Trial 34 finished with value: 0.7045180312135411 and parameters: {'n_components': 2, 'scaler_type': 'MaxAbsScaler'}. Best is trial 16 with value: 0.7755014923639735.
/home/garrett_reinhard_afrl_af_mil/miniconda3/envs/Ising/lib/python3.13/site-packages/numpy/_core/_methods.py:193: RuntimeWarning: overflow encountered in multiply
  x = um.multiply(x, x, out=x)
/home/garrett_reinhard_afrl_af_mil/miniconda3/envs/Ising/lib/python3.13/site-packages/numpy/_core/_methods.py:204: RuntimeWarning: overflow encountered in reduce
  ret = umr_sum(x, axis, dtype, out, keepdims=keepdims, where=where)
[I 2025-07-10 22:28:26,930] Trial 35 finished with value: 0.6473663866295618 and parameters: {'n_components': 3, 'scaler_type': 'PowerTransformer'}. Best is trial 16 with value: 0.7755014923639735.
[I 2025-07-10 22:28:41,106] Trial 36 finished with value: 0.7755014926886954 and parameters: {'n_components': 2, 'scaler_type': 'StandardScaler'}. Best is trial 36 with value: 0.7755014926886954.
[I 2025-07-10 22:28:55,156] Trial 37 finished with value: 0.70451803121881 and parameters: {'n_components': 2, 'scaler_type': 'MinMaxScaler'}. Best is trial 36 with value: 0.7755014926886954.
[I 2025-07-10 22:29:09,391] Trial 38 finished with value: 0.6473663861313699 and parameters: {'n_components': 3, 'scaler_type': 'StandardScaler'}. Best is trial 36 with value: 0.7755014926886954.
[I 2025-07-10 22:29:23,675] Trial 39 finished with value: 0.6279038718784776 and parameters: {'n_components': 4, 'scaler_type': 'StandardScaler'}. Best is trial 36 with value: 0.7755014926886954.
[I 2025-07-10 22:29:37,819] Trial 40 finished with value: 0.7045180312167454 and parameters: {'n_components': 2, 'scaler_type': 'MaxAbsScaler'}. Best is trial 36 with value: 0.7755014926886954.
[I 2025-07-10 22:29:52,063] Trial 41 finished with value: 0.7755014910905793 and parameters: {'n_components': 2, 'scaler_type': 'StandardScaler'}. Best is trial 36 with value: 0.7755014926886954.
[I 2025-07-10 22:30:06,191] Trial 42 finished with value: 0.7755014918110733 and parameters: {'n_components': 2, 'scaler_type': 'StandardScaler'}. Best is trial 36 with value: 0.7755014926886954.
[I 2025-07-10 22:30:20,330] Trial 43 finished with value: 0.7755014910949313 and parameters: {'n_components': 2, 'scaler_type': 'StandardScaler'}. Best is trial 36 with value: 0.7755014926886954.
[I 2025-07-10 22:30:34,404] Trial 44 finished with value: 0.7045180312159434 and parameters: {'n_components': 2, 'scaler_type': 'MinMaxScaler'}. Best is trial 36 with value: 0.7755014926886954.
/home/garrett_reinhard_afrl_af_mil/miniconda3/envs/Ising/lib/python3.13/site-packages/numpy/_core/_methods.py:193: RuntimeWarning: overflow encountered in multiply
  x = um.multiply(x, x, out=x)
/home/garrett_reinhard_afrl_af_mil/miniconda3/envs/Ising/lib/python3.13/site-packages/numpy/_core/_methods.py:204: RuntimeWarning: overflow encountered in reduce
  ret = umr_sum(x, axis, dtype, out, keepdims=keepdims, where=where)
[I 2025-07-10 22:30:51,077] Trial 45 finished with value: 0.6473663856723131 and parameters: {'n_components': 3, 'scaler_type': 'PowerTransformer'}. Best is trial 36 with value: 0.7755014926886954.
[I 2025-07-10 22:31:05,352] Trial 46 finished with value: 0.7755014918648956 and parameters: {'n_components': 2, 'scaler_type': 'StandardScaler'}. Best is trial 36 with value: 0.7755014926886954.
[I 2025-07-10 22:31:19,522] Trial 47 finished with value: 0.7755014927438988 and parameters: {'n_components': 2, 'scaler_type': 'StandardScaler'}. Best is trial 47 with value: 0.7755014927438988.
[I 2025-07-10 22:31:33,555] Trial 48 finished with value: 0.6579113917988747 and parameters: {'n_components': 3, 'scaler_type': 'MinMaxScaler'}. Best is trial 47 with value: 0.7755014927438988.
/home/garrett_reinhard_afrl_af_mil/miniconda3/envs/Ising/lib/python3.13/site-packages/numpy/_core/_methods.py:193: RuntimeWarning: overflow encountered in multiply
  x = um.multiply(x, x, out=x)
/home/garrett_reinhard_afrl_af_mil/miniconda3/envs/Ising/lib/python3.13/site-packages/numpy/_core/_methods.py:204: RuntimeWarning: overflow encountered in reduce
  ret = umr_sum(x, axis, dtype, out, keepdims=keepdims, where=where)
[I 2025-07-10 22:31:50,265] Trial 49 finished with value: 0.7755014918184304 and parameters: {'n_components': 2, 'scaler_type': 'PowerTransformer'}. Best is trial 47 with value: 0.7755014927438988.
[I 2025-07-10 22:32:04,480] Trial 50 finished with value: 0.5772059273786881 and parameters: {'n_components': 6, 'scaler_type': 'StandardScaler'}. Best is trial 47 with value: 0.7755014927438988.
[I 2025-07-10 22:32:18,740] Trial 51 finished with value: 0.775501491377854 and parameters: {'n_components': 2, 'scaler_type': 'StandardScaler'}. Best is trial 47 with value: 0.7755014927438988.
[I 2025-07-10 22:32:32,827] Trial 52 finished with value: 0.7755014921346703 and parameters: {'n_components': 2, 'scaler_type': 'StandardScaler'}. Best is trial 47 with value: 0.7755014927438988.
[I 2025-07-10 22:32:46,990] Trial 53 finished with value: 0.7755014916729731 and parameters: {'n_components': 2, 'scaler_type': 'StandardScaler'}. Best is trial 47 with value: 0.7755014927438988.
[I 2025-07-10 22:33:02,270] Trial 54 finished with value: 0.7002571259976293 and parameters: {'n_components': 2, 'scaler_type': 'RobustScaler'}. Best is trial 47 with value: 0.7755014927438988.
[I 2025-07-10 22:33:16,424] Trial 55 finished with value: 0.7755014922936796 and parameters: {'n_components': 2, 'scaler_type': 'StandardScaler'}. Best is trial 47 with value: 0.7755014927438988.
[I 2025-07-10 22:33:30,682] Trial 56 finished with value: 0.6473663853668431 and parameters: {'n_components': 3, 'scaler_type': 'StandardScaler'}. Best is trial 47 with value: 0.7755014927438988.
