[I 2025-07-10 21:17:24,068] A new study created in memory with name: pca_kmeans_optimization
[I 2025-07-10 21:17:38,428] Trial 0 finished with value: 0.34927609265457166 and parameters: {'n_components': 2, 'scaler_type': 'MaxAbsScaler'}. Best is trial 0 with value: 0.34927609265457166.
[I 2025-07-10 21:18:17,620] Trial 1 finished with value: 0.1256781578689097 and parameters: {'n_components': 6, 'scaler_type': 'PowerTransformer'}. Best is trial 0 with value: 0.34927609265457166.
[I 2025-07-10 21:18:31,855] Trial 2 finished with value: 0.3259516721581651 and parameters: {'n_components': 2, 'scaler_type': 'StandardScaler'}. Best is trial 0 with value: 0.34927609265457166.
[I 2025-07-10 21:18:45,892] Trial 3 finished with value: 0.32054352251507157 and parameters: {'n_components': 2, 'scaler_type': 'MaxAbsScaler'}. Best is trial 0 with value: 0.34927609265457166.
[I 2025-07-10 21:19:01,644] Trial 4 finished with value: 0.185118867240361 and parameters: {'n_components': 4, 'scaler_type': 'RobustScaler'}. Best is trial 0 with value: 0.34927609265457166.
[I 2025-07-10 21:19:41,332] Trial 5 finished with value: 0.33703651797060624 and parameters: {'n_components': 2, 'scaler_type': 'PowerTransformer'}. Best is trial 0 with value: 0.34927609265457166.
[I 2025-07-10 21:19:55,602] Trial 6 finished with value: 0.2960371650153214 and parameters: {'n_components': 2, 'scaler_type': 'StandardScaler'}. Best is trial 0 with value: 0.34927609265457166.
[I 2025-07-10 21:20:11,276] Trial 7 finished with value: 0.2375112025255335 and parameters: {'n_components': 3, 'scaler_type': 'RobustScaler'}. Best is trial 0 with value: 0.34927609265457166.
[I 2025-07-10 21:20:25,551] Trial 8 finished with value: 0.16572272602349802 and parameters: {'n_components': 4, 'scaler_type': 'StandardScaler'}. Best is trial 0 with value: 0.34927609265457166.
[I 2025-07-10 21:20:39,669] Trial 9 finished with value: 0.3142816037710512 and parameters: {'n_components': 2, 'scaler_type': 'MinMaxScaler'}. Best is trial 0 with value: 0.34927609265457166.
[I 2025-07-10 21:20:53,917] Trial 10 finished with value: 0.1417925487787067 and parameters: {'n_components': 6, 'scaler_type': 'MaxAbsScaler'}. Best is trial 0 with value: 0.34927609265457166.
[I 2025-07-10 21:21:33,183] Trial 11 finished with value: 0.23838974336238183 and parameters: {'n_components': 3, 'scaler_type': 'PowerTransformer'}. Best is trial 0 with value: 0.34927609265457166.
[I 2025-07-10 21:22:12,343] Trial 12 finished with value: 0.23478626882718967 and parameters: {'n_components': 3, 'scaler_type': 'PowerTransformer'}. Best is trial 0 with value: 0.34927609265457166.
[I 2025-07-10 21:22:26,572] Trial 13 finished with value: 0.1753049082863435 and parameters: {'n_components': 4, 'scaler_type': 'MaxAbsScaler'}. Best is trial 0 with value: 0.34927609265457166.
[I 2025-07-10 21:22:40,718] Trial 14 finished with value: 0.16354143729635856 and parameters: {'n_components': 5, 'scaler_type': 'MinMaxScaler'}. Best is trial 0 with value: 0.34927609265457166.
[I 2025-07-10 21:23:20,100] Trial 15 finished with value: 0.22070349003057274 and parameters: {'n_components': 3, 'scaler_type': 'PowerTransformer'}. Best is trial 0 with value: 0.34927609265457166.
[I 2025-07-10 21:23:34,330] Trial 16 finished with value: 0.30041387377594186 and parameters: {'n_components': 2, 'scaler_type': 'MaxAbsScaler'}. Best is trial 0 with value: 0.34927609265457166.
[I 2025-07-10 21:23:48,496] Trial 17 finished with value: 0.1686881031088528 and parameters: {'n_components': 5, 'scaler_type': 'MaxAbsScaler'}. Best is trial 0 with value: 0.34927609265457166.
[I 2025-07-10 21:24:27,628] Trial 18 finished with value: 0.22923590424718293 and parameters: {'n_components': 3, 'scaler_type': 'PowerTransformer'}. Best is trial 0 with value: 0.34927609265457166.
[I 2025-07-10 21:24:41,782] Trial 19 finished with value: 0.38303757198499044 and parameters: {'n_components': 2, 'scaler_type': 'MinMaxScaler'}. Best is trial 19 with value: 0.38303757198499044.
[I 2025-07-10 21:24:55,955] Trial 20 finished with value: 0.13773312787877431 and parameters: {'n_components': 5, 'scaler_type': 'MinMaxScaler'}. Best is trial 19 with value: 0.38303757198499044.
[I 2025-07-10 21:25:10,119] Trial 21 finished with value: 0.3104468101547997 and parameters: {'n_components': 2, 'scaler_type': 'MinMaxScaler'}. Best is trial 19 with value: 0.38303757198499044.
[I 2025-07-10 21:25:24,269] Trial 22 finished with value: 0.3209500699457276 and parameters: {'n_components': 2, 'scaler_type': 'MinMaxScaler'}. Best is trial 19 with value: 0.38303757198499044.
[I 2025-07-10 21:25:39,854] Trial 23 finished with value: 0.2584010987050793 and parameters: {'n_components': 3, 'scaler_type': 'RobustScaler'}. Best is trial 19 with value: 0.38303757198499044.
[I 2025-07-10 21:25:54,121] Trial 24 finished with value: 0.32506982455672406 and parameters: {'n_components': 2, 'scaler_type': 'MaxAbsScaler'}. Best is trial 19 with value: 0.38303757198499044.
[I 2025-07-10 21:26:33,426] Trial 25 finished with value: 0.22059149795872504 and parameters: {'n_components': 3, 'scaler_type': 'PowerTransformer'}. Best is trial 19 with value: 0.38303757198499044.
[I 2025-07-10 21:26:47,628] Trial 26 finished with value: 0.354383984459019 and parameters: {'n_components': 2, 'scaler_type': 'MinMaxScaler'}. Best is trial 19 with value: 0.38303757198499044.
[I 2025-07-10 21:27:01,818] Trial 27 finished with value: 0.17691386617232707 and parameters: {'n_components': 4, 'scaler_type': 'MinMaxScaler'}. Best is trial 19 with value: 0.38303757198499044.
[I 2025-07-10 21:27:15,949] Trial 28 finished with value: 0.3333639287272342 and parameters: {'n_components': 2, 'scaler_type': 'MinMaxScaler'}. Best is trial 19 with value: 0.38303757198499044.
[I 2025-07-10 21:27:30,207] Trial 29 finished with value: 0.24799244037709162 and parameters: {'n_components': 3, 'scaler_type': 'MinMaxScaler'}. Best is trial 19 with value: 0.38303757198499044.
[I 2025-07-10 21:27:44,403] Trial 30 finished with value: 0.32029809300956 and parameters: {'n_components': 2, 'scaler_type': 'MinMaxScaler'}. Best is trial 19 with value: 0.38303757198499044.
[I 2025-07-10 21:28:23,853] Trial 31 finished with value: 0.3327157121957322 and parameters: {'n_components': 2, 'scaler_type': 'PowerTransformer'}. Best is trial 19 with value: 0.38303757198499044.
[I 2025-07-10 21:28:38,092] Trial 32 finished with value: 0.32378403260351535 and parameters: {'n_components': 2, 'scaler_type': 'StandardScaler'}. Best is trial 19 with value: 0.38303757198499044.
[I 2025-07-10 21:28:52,287] Trial 33 finished with value: 0.33884888602070606 and parameters: {'n_components': 2, 'scaler_type': 'MaxAbsScaler'}. Best is trial 19 with value: 0.38303757198499044.
[I 2025-07-10 21:29:06,472] Trial 34 finished with value: 0.3185772049751913 and parameters: {'n_components': 2, 'scaler_type': 'MaxAbsScaler'}. Best is trial 19 with value: 0.38303757198499044.
[I 2025-07-10 21:29:20,706] Trial 35 finished with value: 0.32992992129881715 and parameters: {'n_components': 2, 'scaler_type': 'MaxAbsScaler'}. Best is trial 19 with value: 0.38303757198499044.
[I 2025-07-10 21:29:34,919] Trial 36 finished with value: 0.24197420451225168 and parameters: {'n_components': 3, 'scaler_type': 'MaxAbsScaler'}. Best is trial 19 with value: 0.38303757198499044.
[I 2025-07-10 21:29:50,538] Trial 37 finished with value: 0.35961683961290064 and parameters: {'n_components': 2, 'scaler_type': 'RobustScaler'}. Best is trial 19 with value: 0.38303757198499044.
[I 2025-07-10 21:30:06,214] Trial 38 finished with value: 0.2425348132196886 and parameters: {'n_components': 3, 'scaler_type': 'RobustScaler'}. Best is trial 19 with value: 0.38303757198499044.
[I 2025-07-10 21:30:21,821] Trial 39 finished with value: 0.335932056736806 and parameters: {'n_components': 2, 'scaler_type': 'RobustScaler'}. Best is trial 19 with value: 0.38303757198499044.
[I 2025-07-10 21:30:37,467] Trial 40 finished with value: 0.30884653926962363 and parameters: {'n_components': 2, 'scaler_type': 'RobustScaler'}. Best is trial 19 with value: 0.38303757198499044.
[I 2025-07-10 21:30:53,213] Trial 41 finished with value: 0.34874706306396136 and parameters: {'n_components': 2, 'scaler_type': 'RobustScaler'}. Best is trial 19 with value: 0.38303757198499044.
[I 2025-07-10 21:31:08,839] Trial 42 finished with value: 0.3759331755094546 and parameters: {'n_components': 2, 'scaler_type': 'RobustScaler'}. Best is trial 19 with value: 0.38303757198499044.
[I 2025-07-10 21:31:24,485] Trial 43 finished with value: 0.30246874736408963 and parameters: {'n_components': 2, 'scaler_type': 'RobustScaler'}. Best is trial 19 with value: 0.38303757198499044.
[I 2025-07-10 21:31:40,152] Trial 44 finished with value: 0.31221605874589625 and parameters: {'n_components': 2, 'scaler_type': 'RobustScaler'}. Best is trial 19 with value: 0.38303757198499044.
[I 2025-07-10 21:31:54,516] Trial 45 finished with value: 0.12776185177366303 and parameters: {'n_components': 6, 'scaler_type': 'StandardScaler'}. Best is trial 19 with value: 0.38303757198499044.
[I 2025-07-10 21:32:10,132] Trial 46 finished with value: 0.22800547017694853 and parameters: {'n_components': 3, 'scaler_type': 'RobustScaler'}. Best is trial 19 with value: 0.38303757198499044.
[I 2025-07-10 21:32:24,468] Trial 47 finished with value: 0.32865950969920815 and parameters: {'n_components': 2, 'scaler_type': 'MinMaxScaler'}. Best is trial 19 with value: 0.38303757198499044.
[I 2025-07-10 21:32:40,202] Trial 48 finished with value: 0.227502846167723 and parameters: {'n_components': 3, 'scaler_type': 'RobustScaler'}. Best is trial 19 with value: 0.38303757198499044.
[I 2025-07-10 21:32:54,495] Trial 49 finished with value: 0.33155201732617806 and parameters: {'n_components': 2, 'scaler_type': 'StandardScaler'}. Best is trial 19 with value: 0.38303757198499044.
[I 2025-07-10 21:33:08,759] Trial 50 finished with value: 0.22966420872587281 and parameters: {'n_components': 3, 'scaler_type': 'MinMaxScaler'}. Best is trial 19 with value: 0.38303757198499044.
[I 2025-07-10 21:33:24,410] Trial 51 finished with value: 0.33619688167853873 and parameters: {'n_components': 2, 'scaler_type': 'RobustScaler'}. Best is trial 19 with value: 0.38303757198499044.
[I 2025-07-10 21:33:40,080] Trial 52 finished with value: 0.3459190518824945 and parameters: {'n_components': 2, 'scaler_type': 'RobustScaler'}. Best is trial 19 with value: 0.38303757198499044.
[I 2025-07-10 21:33:55,689] Trial 53 finished with value: 0.3095616788371837 and parameters: {'n_components': 2, 'scaler_type': 'RobustScaler'}. Best is trial 19 with value: 0.38303757198499044.
[I 2025-07-10 21:34:11,321] Trial 54 finished with value: 0.308840015107614 and parameters: {'n_components': 2, 'scaler_type': 'RobustScaler'}. Best is trial 19 with value: 0.38303757198499044.
[I 2025-07-10 21:34:27,114] Trial 55 finished with value: 0.3409244951449329 and parameters: {'n_components': 2, 'scaler_type': 'RobustScaler'}. Best is trial 19 with value: 0.38303757198499044.
[I 2025-07-10 21:34:41,295] Trial 56 finished with value: 0.29962032295718977 and parameters: {'n_components': 2, 'scaler_type': 'MinMaxScaler'}. Best is trial 19 with value: 0.38303757198499044.
[I 2025-07-10 21:34:57,058] Trial 57 finished with value: 0.18398459142745857 and parameters: {'n_components': 4, 'scaler_type': 'RobustScaler'}. Best is trial 19 with value: 0.38303757198499044.
[I 2025-07-10 21:35:11,311] Trial 58 finished with value: 0.3122296404735147 and parameters: {'n_components': 2, 'scaler_type': 'MinMaxScaler'}. Best is trial 19 with value: 0.38303757198499044.
[I 2025-07-10 21:35:25,488] Trial 59 finished with value: 0.2303986215941084 and parameters: {'n_components': 3, 'scaler_type': 'MaxAbsScaler'}. Best is trial 19 with value: 0.38303757198499044.
[I 2025-07-10 21:35:39,752] Trial 60 finished with value: 0.32008375509852854 and parameters: {'n_components': 2, 'scaler_type': 'MinMaxScaler'}. Best is trial 19 with value: 0.38303757198499044.
[I 2025-07-10 21:35:55,467] Trial 61 finished with value: 0.33932875274846924 and parameters: {'n_components': 2, 'scaler_type': 'RobustScaler'}. Best is trial 19 with value: 0.38303757198499044.
[I 2025-07-10 21:36:11,057] Trial 62 finished with value: 0.32243898946569866 and parameters: {'n_components': 2, 'scaler_type': 'RobustScaler'}. Best is trial 19 with value: 0.38303757198499044.
[I 2025-07-10 21:36:26,733] Trial 63 finished with value: 0.29143056374169246 and parameters: {'n_components': 2, 'scaler_type': 'RobustScaler'}. Best is trial 19 with value: 0.38303757198499044.
[I 2025-07-10 21:36:42,378] Trial 64 finished with value: 0.3106501068682319 and parameters: {'n_components': 2, 'scaler_type': 'RobustScaler'}. Best is trial 19 with value: 0.38303757198499044.
[I 2025-07-10 21:36:58,036] Trial 65 finished with value: 0.1519377621626966 and parameters: {'n_components': 5, 'scaler_type': 'RobustScaler'}. Best is trial 19 with value: 0.38303757198499044.
[I 2025-07-10 21:37:12,344] Trial 66 finished with value: 0.33912564877309276 and parameters: {'n_components': 2, 'scaler_type': 'StandardScaler'}. Best is trial 19 with value: 0.38303757198499044.
[I 2025-07-10 21:37:51,634] Trial 67 finished with value: 0.31056748129490996 and parameters: {'n_components': 2, 'scaler_type': 'PowerTransformer'}. Best is trial 19 with value: 0.38303757198499044.
[I 2025-07-10 21:38:06,002] Trial 68 finished with value: 0.23728672392304165 and parameters: {'n_components': 3, 'scaler_type': 'MinMaxScaler'}. Best is trial 19 with value: 0.38303757198499044.
[I 2025-07-10 21:38:20,308] Trial 69 finished with value: 0.34505170168165517 and parameters: {'n_components': 2, 'scaler_type': 'MaxAbsScaler'}. Best is trial 19 with value: 0.38303757198499044.
[I 2025-07-10 21:38:36,024] Trial 70 finished with value: 0.3154536748865755 and parameters: {'n_components': 2, 'scaler_type': 'RobustScaler'}. Best is trial 19 with value: 0.38303757198499044.
[I 2025-07-10 21:38:50,300] Trial 71 finished with value: 0.3450855752206948 and parameters: {'n_components': 2, 'scaler_type': 'MaxAbsScaler'}. Best is trial 19 with value: 0.38303757198499044.
[I 2025-07-10 21:39:04,557] Trial 72 finished with value: 0.33774192823217347 and parameters: {'n_components': 2, 'scaler_type': 'MaxAbsScaler'}. Best is trial 19 with value: 0.38303757198499044.
[I 2025-07-10 21:39:18,801] Trial 73 finished with value: 0.30406641573441817 and parameters: {'n_components': 2, 'scaler_type': 'MaxAbsScaler'}. Best is trial 19 with value: 0.38303757198499044.
[I 2025-07-10 21:39:32,940] Trial 74 finished with value: 0.309475567543614 and parameters: {'n_components': 2, 'scaler_type': 'MaxAbsScaler'}. Best is trial 19 with value: 0.38303757198499044.
[I 2025-07-10 21:39:48,079] A new study created in memory with name: pca_kmeans_optimization
[I 2025-07-10 21:40:03,122] Trial 0 finished with value: 0.42258991924894035 and parameters: {'n_components': 5, 'scaler_type': 'RobustScaler'}. Best is trial 0 with value: 0.42258991924894035.
/home/garrett_reinhard_afrl_af_mil/miniconda3/envs/Ising/lib/python3.13/site-packages/numpy/_core/_methods.py:193: RuntimeWarning: overflow encountered in multiply
  x = um.multiply(x, x, out=x)
/home/garrett_reinhard_afrl_af_mil/miniconda3/envs/Ising/lib/python3.13/site-packages/numpy/_core/_methods.py:204: RuntimeWarning: overflow encountered in reduce
  ret = umr_sum(x, axis, dtype, out, keepdims=keepdims, where=where)
[I 2025-07-10 21:40:36,108] Trial 1 finished with value: 0.4344632773735639 and parameters: {'n_components': 6, 'scaler_type': 'PowerTransformer'}. Best is trial 1 with value: 0.4344632773735639.
[I 2025-07-10 21:40:49,880] Trial 2 finished with value: 0.5684707599749547 and parameters: {'n_components': 3, 'scaler_type': 'MinMaxScaler'}. Best is trial 2 with value: 0.5684707599749547.
/home/garrett_reinhard_afrl_af_mil/miniconda3/envs/Ising/lib/python3.13/site-packages/numpy/_core/_methods.py:193: RuntimeWarning: overflow encountered in multiply
  x = um.multiply(x, x, out=x)
/home/garrett_reinhard_afrl_af_mil/miniconda3/envs/Ising/lib/python3.13/site-packages/numpy/_core/_methods.py:204: RuntimeWarning: overflow encountered in reduce
  ret = umr_sum(x, axis, dtype, out, keepdims=keepdims, where=where)
[I 2025-07-10 21:41:22,619] Trial 3 finished with value: 0.5206106970287652 and parameters: {'n_components': 3, 'scaler_type': 'PowerTransformer'}. Best is trial 2 with value: 0.5684707599749547.
[I 2025-07-10 21:41:36,386] Trial 4 finished with value: 0.4884404672194764 and parameters: {'n_components': 6, 'scaler_type': 'MaxAbsScaler'}. Best is trial 2 with value: 0.5684707599749547.
[I 2025-07-10 21:41:50,218] Trial 5 finished with value: 0.6171573436959582 and parameters: {'n_components': 2, 'scaler_type': 'MinMaxScaler'}. Best is trial 5 with value: 0.6171573436959582.
/home/garrett_reinhard_afrl_af_mil/miniconda3/envs/Ising/lib/python3.13/site-packages/numpy/_core/_methods.py:193: RuntimeWarning: overflow encountered in multiply
  x = um.multiply(x, x, out=x)
/home/garrett_reinhard_afrl_af_mil/miniconda3/envs/Ising/lib/python3.13/site-packages/numpy/_core/_methods.py:204: RuntimeWarning: overflow encountered in reduce
  ret = umr_sum(x, axis, dtype, out, keepdims=keepdims, where=where)
[I 2025-07-10 21:42:23,014] Trial 6 finished with value: 0.5835419660207058 and parameters: {'n_components': 2, 'scaler_type': 'PowerTransformer'}. Best is trial 5 with value: 0.6171573436959582.
[I 2025-07-10 21:42:38,170] Trial 7 finished with value: 0.45072665857305444 and parameters: {'n_components': 4, 'scaler_type': 'RobustScaler'}. Best is trial 5 with value: 0.6171573436959582.
[I 2025-07-10 21:42:51,994] Trial 8 finished with value: 0.5420228340198631 and parameters: {'n_components': 4, 'scaler_type': 'MinMaxScaler'}. Best is trial 5 with value: 0.6171573436959582.
[I 2025-07-10 21:43:05,825] Trial 9 finished with value: 0.5684707606746886 and parameters: {'n_components': 3, 'scaler_type': 'MinMaxScaler'}. Best is trial 5 with value: 0.6171573436959582.
[I 2025-07-10 21:43:19,730] Trial 10 finished with value: 0.5835419673830075 and parameters: {'n_components': 2, 'scaler_type': 'StandardScaler'}. Best is trial 5 with value: 0.6171573436959582.
[I 2025-07-10 21:43:33,566] Trial 11 finished with value: 0.5835419670477238 and parameters: {'n_components': 2, 'scaler_type': 'StandardScaler'}. Best is trial 5 with value: 0.6171573436959582.
[I 2025-07-10 21:43:47,546] Trial 12 finished with value: 0.5835419679401523 and parameters: {'n_components': 2, 'scaler_type': 'StandardScaler'}. Best is trial 5 with value: 0.6171573436959582.
[I 2025-07-10 21:44:01,495] Trial 13 finished with value: 0.5835419670614099 and parameters: {'n_components': 2, 'scaler_type': 'StandardScaler'}. Best is trial 5 with value: 0.6171573436959582.
[I 2025-07-10 21:44:15,391] Trial 14 finished with value: 0.5684707606396039 and parameters: {'n_components': 3, 'scaler_type': 'MaxAbsScaler'}. Best is trial 5 with value: 0.6171573436959582.
[I 2025-07-10 21:44:29,335] Trial 15 finished with value: 0.485687397508624 and parameters: {'n_components': 4, 'scaler_type': 'StandardScaler'}. Best is trial 5 with value: 0.6171573436959582.
[I 2025-07-10 21:44:43,127] Trial 16 finished with value: 0.6171573436554806 and parameters: {'n_components': 2, 'scaler_type': 'MinMaxScaler'}. Best is trial 5 with value: 0.6171573436959582.
[I 2025-07-10 21:44:56,984] Trial 17 finished with value: 0.5077301523365996 and parameters: {'n_components': 5, 'scaler_type': 'MinMaxScaler'}. Best is trial 5 with value: 0.6171573436959582.
[I 2025-07-10 21:45:10,882] Trial 18 finished with value: 0.5684707609158013 and parameters: {'n_components': 3, 'scaler_type': 'MinMaxScaler'}. Best is trial 5 with value: 0.6171573436959582.
[I 2025-07-10 21:45:24,668] Trial 19 finished with value: 0.6171573435032454 and parameters: {'n_components': 2, 'scaler_type': 'MinMaxScaler'}. Best is trial 5 with value: 0.6171573436959582.
[I 2025-07-10 21:45:38,501] Trial 20 finished with value: 0.5420228526352838 and parameters: {'n_components': 4, 'scaler_type': 'MinMaxScaler'}. Best is trial 5 with value: 0.6171573436959582.
[I 2025-07-10 21:45:52,293] Trial 21 finished with value: 0.6171573436883966 and parameters: {'n_components': 2, 'scaler_type': 'MinMaxScaler'}. Best is trial 5 with value: 0.6171573436959582.
[I 2025-07-10 21:46:06,037] Trial 22 finished with value: 0.6171573436959014 and parameters: {'n_components': 2, 'scaler_type': 'MinMaxScaler'}. Best is trial 5 with value: 0.6171573436959582.
[I 2025-07-10 21:46:19,961] Trial 23 finished with value: 0.5684707599220263 and parameters: {'n_components': 3, 'scaler_type': 'MinMaxScaler'}. Best is trial 5 with value: 0.6171573436959582.
[I 2025-07-10 21:46:33,813] Trial 24 finished with value: 0.6171573436828134 and parameters: {'n_components': 2, 'scaler_type': 'MinMaxScaler'}. Best is trial 5 with value: 0.6171573436959582.
[I 2025-07-10 21:46:48,910] Trial 25 finished with value: 0.511636550178305 and parameters: {'n_components': 3, 'scaler_type': 'RobustScaler'}. Best is trial 5 with value: 0.6171573436959582.
[I 2025-07-10 21:47:02,713] Trial 26 finished with value: 0.6171573436662259 and parameters: {'n_components': 2, 'scaler_type': 'MinMaxScaler'}. Best is trial 5 with value: 0.6171573436959582.
[I 2025-07-10 21:47:16,564] Trial 27 finished with value: 0.5077301285187432 and parameters: {'n_components': 5, 'scaler_type': 'MaxAbsScaler'}. Best is trial 5 with value: 0.6171573436959582.
[I 2025-07-10 21:47:30,425] Trial 28 finished with value: 0.5684707618041024 and parameters: {'n_components': 3, 'scaler_type': 'MinMaxScaler'}. Best is trial 5 with value: 0.6171573436959582.
[I 2025-07-10 21:47:45,595] Trial 29 finished with value: 0.5274835802988052 and parameters: {'n_components': 2, 'scaler_type': 'RobustScaler'}. Best is trial 5 with value: 0.6171573436959582.
