[I 2025-07-10 22:33:44,754] Trial 57 finished with value: 0.7755014935266674 and parameters: {'n_components': 2, 'scaler_type': 'StandardScaler'}. Best is trial 57 with value: 0.7755014935266674.
[I 2025-07-10 22:33:58,978] Trial 58 finished with value: 0.6012638378326504 and parameters: {'n_components': 5, 'scaler_type': 'StandardScaler'}. Best is trial 57 with value: 0.7755014935266674.
[I 2025-07-10 22:34:14,439] Trial 59 finished with value: 0.6576365239141375 and parameters: {'n_components': 3, 'scaler_type': 'RobustScaler'}. Best is trial 57 with value: 0.7755014935266674.
[I 2025-07-10 22:34:28,545] Trial 60 finished with value: 0.7045180312480771 and parameters: {'n_components': 2, 'scaler_type': 'MaxAbsScaler'}. Best is trial 57 with value: 0.7755014935266674.
[I 2025-07-10 22:34:42,704] Trial 61 finished with value: 0.7755014905207611 and parameters: {'n_components': 2, 'scaler_type': 'StandardScaler'}. Best is trial 57 with value: 0.7755014935266674.
[I 2025-07-10 22:34:56,957] Trial 62 finished with value: 0.7755014922728871 and parameters: {'n_components': 2, 'scaler_type': 'StandardScaler'}. Best is trial 57 with value: 0.7755014935266674.
[I 2025-07-10 22:35:11,195] Trial 63 finished with value: 0.7755014924863269 and parameters: {'n_components': 2, 'scaler_type': 'StandardScaler'}. Best is trial 57 with value: 0.7755014935266674.
[I 2025-07-10 22:35:25,537] Trial 64 finished with value: 0.7755014923348861 and parameters: {'n_components': 2, 'scaler_type': 'StandardScaler'}. Best is trial 57 with value: 0.7755014935266674.
[I 2025-07-10 22:35:39,765] Trial 65 finished with value: 0.7755014917194122 and parameters: {'n_components': 2, 'scaler_type': 'StandardScaler'}. Best is trial 57 with value: 0.7755014935266674.
[I 2025-07-10 22:35:53,973] Trial 66 finished with value: 0.7755014919142973 and parameters: {'n_components': 2, 'scaler_type': 'StandardScaler'}. Best is trial 57 with value: 0.7755014935266674.
[I 2025-07-10 22:36:08,247] Trial 67 finished with value: 0.7755014911425037 and parameters: {'n_components': 2, 'scaler_type': 'StandardScaler'}. Best is trial 57 with value: 0.7755014935266674.
[I 2025-07-10 22:36:22,476] Trial 68 finished with value: 0.7755014925175069 and parameters: {'n_components': 2, 'scaler_type': 'StandardScaler'}. Best is trial 57 with value: 0.7755014935266674.
[I 2025-07-10 22:36:36,575] Trial 69 finished with value: 0.7755014919046348 and parameters: {'n_components': 2, 'scaler_type': 'StandardScaler'}. Best is trial 57 with value: 0.7755014935266674.
[I 2025-07-10 22:36:50,743] Trial 70 finished with value: 0.6473663872910858 and parameters: {'n_components': 3, 'scaler_type': 'StandardScaler'}. Best is trial 57 with value: 0.7755014935266674.
[I 2025-07-10 22:37:04,841] Trial 71 finished with value: 0.7755014913283644 and parameters: {'n_components': 2, 'scaler_type': 'StandardScaler'}. Best is trial 57 with value: 0.7755014935266674.
[I 2025-07-10 22:37:19,106] Trial 72 finished with value: 0.7755014915272557 and parameters: {'n_components': 2, 'scaler_type': 'StandardScaler'}. Best is trial 57 with value: 0.7755014935266674.
[I 2025-07-10 22:37:33,208] Trial 73 finished with value: 0.7755014915336139 and parameters: {'n_components': 2, 'scaler_type': 'StandardScaler'}. Best is trial 57 with value: 0.7755014935266674.
[I 2025-07-10 22:37:47,402] Trial 74 finished with value: 0.7755014925303033 and parameters: {'n_components': 2, 'scaler_type': 'StandardScaler'}. Best is trial 57 with value: 0.7755014935266674.
[I 2025-07-10 22:38:02,349] A new study created in memory with name: pca_kmeans_optimization
/home/garrett_reinhard_afrl_af_mil/miniconda3/envs/Ising/lib/python3.13/site-packages/numpy/_core/_methods.py:193: RuntimeWarning: overflow encountered in multiply
  x = um.multiply(x, x, out=x)
/home/garrett_reinhard_afrl_af_mil/miniconda3/envs/Ising/lib/python3.13/site-packages/numpy/_core/_methods.py:204: RuntimeWarning: overflow encountered in reduce
  ret = umr_sum(x, axis, dtype, out, keepdims=keepdims, where=where)
[I 2025-07-10 22:38:21,481] Trial 0 finished with value: 0.5336266778592446 and parameters: {'n_components': 4, 'scaler_type': 'PowerTransformer'}. Best is trial 0 with value: 0.5336266778592446.
[I 2025-07-10 22:38:36,686] Trial 1 finished with value: 0.573564658292752 and parameters: {'n_components': 4, 'scaler_type': 'RobustScaler'}. Best is trial 1 with value: 0.573564658292752.
[I 2025-07-10 22:38:50,600] Trial 2 finished with value: 0.4964667051081456 and parameters: {'n_components': 6, 'scaler_type': 'MaxAbsScaler'}. Best is trial 1 with value: 0.573564658292752.
[I 2025-07-10 22:39:04,510] Trial 3 finished with value: 0.4964667657020747 and parameters: {'n_components': 6, 'scaler_type': 'MinMaxScaler'}. Best is trial 1 with value: 0.573564658292752.
/home/garrett_reinhard_afrl_af_mil/miniconda3/envs/Ising/lib/python3.13/site-packages/numpy/_core/_methods.py:193: RuntimeWarning: overflow encountered in multiply
  x = um.multiply(x, x, out=x)
/home/garrett_reinhard_afrl_af_mil/miniconda3/envs/Ising/lib/python3.13/site-packages/numpy/_core/_methods.py:204: RuntimeWarning: overflow encountered in reduce
  ret = umr_sum(x, axis, dtype, out, keepdims=keepdims, where=where)
[I 2025-07-10 22:39:23,685] Trial 4 finished with value: 0.5152551869677602 and parameters: {'n_components': 5, 'scaler_type': 'PowerTransformer'}. Best is trial 1 with value: 0.573564658292752.
[I 2025-07-10 22:39:37,767] Trial 5 finished with value: 0.4964667779586271 and parameters: {'n_components': 6, 'scaler_type': 'MinMaxScaler'}. Best is trial 1 with value: 0.573564658292752.
[I 2025-07-10 22:39:53,065] Trial 6 finished with value: 0.6020430110004353 and parameters: {'n_components': 3, 'scaler_type': 'RobustScaler'}. Best is trial 6 with value: 0.6020430110004353.
[I 2025-07-10 22:40:07,101] Trial 7 finished with value: 0.5590283784488222 and parameters: {'n_components': 3, 'scaler_type': 'MinMaxScaler'}. Best is trial 6 with value: 0.6020430110004353.
[I 2025-07-10 22:40:22,410] Trial 8 finished with value: 0.5551939591229091 and parameters: {'n_components': 5, 'scaler_type': 'RobustScaler'}. Best is trial 6 with value: 0.6020430110004353.
[I 2025-07-10 22:40:37,640] Trial 9 finished with value: 0.5399703741892045 and parameters: {'n_components': 6, 'scaler_type': 'RobustScaler'}. Best is trial 6 with value: 0.6020430110004353.
[I 2025-07-10 22:40:51,654] Trial 10 finished with value: 0.620094249004728 and parameters: {'n_components': 2, 'scaler_type': 'StandardScaler'}. Best is trial 10 with value: 0.620094249004728.
[I 2025-07-10 22:41:05,784] Trial 11 finished with value: 0.6200942489890157 and parameters: {'n_components': 2, 'scaler_type': 'StandardScaler'}. Best is trial 10 with value: 0.620094249004728.
[I 2025-07-10 22:41:20,029] Trial 12 finished with value: 0.6200942489762706 and parameters: {'n_components': 2, 'scaler_type': 'StandardScaler'}. Best is trial 10 with value: 0.620094249004728.
[I 2025-07-10 22:41:33,995] Trial 13 finished with value: 0.6200942489890637 and parameters: {'n_components': 2, 'scaler_type': 'StandardScaler'}. Best is trial 10 with value: 0.620094249004728.
[I 2025-07-10 22:41:48,019] Trial 14 finished with value: 0.6200942489421102 and parameters: {'n_components': 2, 'scaler_type': 'StandardScaler'}. Best is trial 10 with value: 0.620094249004728.
[I 2025-07-10 22:42:02,083] Trial 15 finished with value: 0.5643955621879574 and parameters: {'n_components': 3, 'scaler_type': 'StandardScaler'}. Best is trial 10 with value: 0.620094249004728.
[I 2025-07-10 22:42:16,106] Trial 16 finished with value: 0.6200942489882795 and parameters: {'n_components': 2, 'scaler_type': 'StandardScaler'}. Best is trial 10 with value: 0.620094249004728.
[I 2025-07-10 22:42:30,118] Trial 17 finished with value: 0.5590283785654242 and parameters: {'n_components': 3, 'scaler_type': 'MaxAbsScaler'}. Best is trial 10 with value: 0.620094249004728.
[I 2025-07-10 22:42:44,136] Trial 18 finished with value: 0.6200942489968754 and parameters: {'n_components': 2, 'scaler_type': 'StandardScaler'}. Best is trial 10 with value: 0.620094249004728.
[I 2025-07-10 22:42:58,125] Trial 19 finished with value: 0.5336266800802231 and parameters: {'n_components': 4, 'scaler_type': 'StandardScaler'}. Best is trial 10 with value: 0.620094249004728.
[I 2025-07-10 22:43:12,241] Trial 20 finished with value: 0.5643955577255745 and parameters: {'n_components': 3, 'scaler_type': 'StandardScaler'}. Best is trial 10 with value: 0.620094249004728.
[I 2025-07-10 22:43:26,240] Trial 21 finished with value: 0.6200942490470971 and parameters: {'n_components': 2, 'scaler_type': 'StandardScaler'}. Best is trial 21 with value: 0.6200942490470971.
[I 2025-07-10 22:43:40,354] Trial 22 finished with value: 0.6200942489774918 and parameters: {'n_components': 2, 'scaler_type': 'StandardScaler'}. Best is trial 21 with value: 0.6200942490470971.
[I 2025-07-10 22:43:54,355] Trial 23 finished with value: 0.6200942490052787 and parameters: {'n_components': 2, 'scaler_type': 'StandardScaler'}. Best is trial 21 with value: 0.6200942490470971.
[I 2025-07-10 22:44:08,377] Trial 24 finished with value: 0.5643955586033383 and parameters: {'n_components': 3, 'scaler_type': 'StandardScaler'}. Best is trial 21 with value: 0.6200942490470971.
/home/garrett_reinhard_afrl_af_mil/miniconda3/envs/Ising/lib/python3.13/site-packages/numpy/_core/_methods.py:193: RuntimeWarning: overflow encountered in multiply
  x = um.multiply(x, x, out=x)
/home/garrett_reinhard_afrl_af_mil/miniconda3/envs/Ising/lib/python3.13/site-packages/numpy/_core/_methods.py:204: RuntimeWarning: overflow encountered in reduce
  ret = umr_sum(x, axis, dtype, out, keepdims=keepdims, where=where)
[I 2025-07-10 22:44:27,344] Trial 25 finished with value: 0.6200942490017235 and parameters: {'n_components': 2, 'scaler_type': 'PowerTransformer'}. Best is trial 21 with value: 0.6200942490470971.
[I 2025-07-10 22:44:41,210] Trial 26 finished with value: 0.559028378212947 and parameters: {'n_components': 3, 'scaler_type': 'MaxAbsScaler'}. Best is trial 21 with value: 0.6200942490470971.
[I 2025-07-10 22:44:55,294] Trial 27 finished with value: 0.6200942488957984 and parameters: {'n_components': 2, 'scaler_type': 'StandardScaler'}. Best is trial 21 with value: 0.6200942490470971.
[I 2025-07-10 22:45:09,357] Trial 28 finished with value: 0.5336266800838637 and parameters: {'n_components': 4, 'scaler_type': 'StandardScaler'}. Best is trial 21 with value: 0.6200942490470971.
/home/garrett_reinhard_afrl_af_mil/miniconda3/envs/Ising/lib/python3.13/site-packages/numpy/_core/_methods.py:193: RuntimeWarning: overflow encountered in multiply
  x = um.multiply(x, x, out=x)
/home/garrett_reinhard_afrl_af_mil/miniconda3/envs/Ising/lib/python3.13/site-packages/numpy/_core/_methods.py:204: RuntimeWarning: overflow encountered in reduce
  ret = umr_sum(x, axis, dtype, out, keepdims=keepdims, where=where)
[I 2025-07-10 22:45:28,540] Trial 29 finished with value: 0.515255133338217 and parameters: {'n_components': 5, 'scaler_type': 'PowerTransformer'}. Best is trial 21 with value: 0.6200942490470971.
[I 2025-07-10 22:45:42,530] Trial 30 finished with value: 0.5643955592919001 and parameters: {'n_components': 3, 'scaler_type': 'StandardScaler'}. Best is trial 21 with value: 0.6200942490470971.
/home/garrett_reinhard_afrl_af_mil/miniconda3/envs/Ising/lib/python3.13/site-packages/numpy/_core/_methods.py:193: RuntimeWarning: overflow encountered in multiply
  x = um.multiply(x, x, out=x)
/home/garrett_reinhard_afrl_af_mil/miniconda3/envs/Ising/lib/python3.13/site-packages/numpy/_core/_methods.py:204: RuntimeWarning: overflow encountered in reduce
  ret = umr_sum(x, axis, dtype, out, keepdims=keepdims, where=where)
[I 2025-07-10 22:46:01,563] Trial 31 finished with value: 0.6200942489820175 and parameters: {'n_components': 2, 'scaler_type': 'PowerTransformer'}. Best is trial 21 with value: 0.6200942490470971.
/home/garrett_reinhard_afrl_af_mil/miniconda3/envs/Ising/lib/python3.13/site-packages/numpy/_core/_methods.py:193: RuntimeWarning: overflow encountered in multiply
  x = um.multiply(x, x, out=x)
/home/garrett_reinhard_afrl_af_mil/miniconda3/envs/Ising/lib/python3.13/site-packages/numpy/_core/_methods.py:204: RuntimeWarning: overflow encountered in reduce
  ret = umr_sum(x, axis, dtype, out, keepdims=keepdims, where=where)
[I 2025-07-10 22:46:20,612] Trial 32 finished with value: 0.6200942490172509 and parameters: {'n_components': 2, 'scaler_type': 'PowerTransformer'}. Best is trial 21 with value: 0.6200942490470971.
/home/garrett_reinhard_afrl_af_mil/miniconda3/envs/Ising/lib/python3.13/site-packages/numpy/_core/_methods.py:193: RuntimeWarning: overflow encountered in multiply
  x = um.multiply(x, x, out=x)
/home/garrett_reinhard_afrl_af_mil/miniconda3/envs/Ising/lib/python3.13/site-packages/numpy/_core/_methods.py:204: RuntimeWarning: overflow encountered in reduce
  ret = umr_sum(x, axis, dtype, out, keepdims=keepdims, where=where)
[I 2025-07-10 22:46:39,750] Trial 33 finished with value: 0.6200942490352697 and parameters: {'n_components': 2, 'scaler_type': 'PowerTransformer'}. Best is trial 21 with value: 0.6200942490470971.
/home/garrett_reinhard_afrl_af_mil/miniconda3/envs/Ising/lib/python3.13/site-packages/numpy/_core/_methods.py:193: RuntimeWarning: overflow encountered in multiply
  x = um.multiply(x, x, out=x)
/home/garrett_reinhard_afrl_af_mil/miniconda3/envs/Ising/lib/python3.13/site-packages/numpy/_core/_methods.py:204: RuntimeWarning: overflow encountered in reduce
  ret = umr_sum(x, axis, dtype, out, keepdims=keepdims, where=where)
[I 2025-07-10 22:46:58,771] Trial 34 finished with value: 0.6200942489702199 and parameters: {'n_components': 2, 'scaler_type': 'PowerTransformer'}. Best is trial 21 with value: 0.6200942490470971.
/home/garrett_reinhard_afrl_af_mil/miniconda3/envs/Ising/lib/python3.13/site-packages/numpy/_core/_methods.py:193: RuntimeWarning: overflow encountered in multiply
  x = um.multiply(x, x, out=x)
/home/garrett_reinhard_afrl_af_mil/miniconda3/envs/Ising/lib/python3.13/site-packages/numpy/_core/_methods.py:204: RuntimeWarning: overflow encountered in reduce
  ret = umr_sum(x, axis, dtype, out, keepdims=keepdims, where=where)
[I 2025-07-10 22:47:17,892] Trial 35 finished with value: 0.6200942489790482 and parameters: {'n_components': 2, 'scaler_type': 'PowerTransformer'}. Best is trial 21 with value: 0.6200942490470971.
/home/garrett_reinhard_afrl_af_mil/miniconda3/envs/Ising/lib/python3.13/site-packages/numpy/_core/_methods.py:193: RuntimeWarning: overflow encountered in multiply
  x = um.multiply(x, x, out=x)
/home/garrett_reinhard_afrl_af_mil/miniconda3/envs/Ising/lib/python3.13/site-packages/numpy/_core/_methods.py:204: RuntimeWarning: overflow encountered in reduce
  ret = umr_sum(x, axis, dtype, out, keepdims=keepdims, where=where)
[I 2025-07-10 22:47:37,018] Trial 36 finished with value: 0.564395559402542 and parameters: {'n_components': 3, 'scaler_type': 'PowerTransformer'}. Best is trial 21 with value: 0.6200942490470971.
/home/garrett_reinhard_afrl_af_mil/miniconda3/envs/Ising/lib/python3.13/site-packages/numpy/_core/_methods.py:193: RuntimeWarning: overflow encountered in multiply
  x = um.multiply(x, x, out=x)
/home/garrett_reinhard_afrl_af_mil/miniconda3/envs/Ising/lib/python3.13/site-packages/numpy/_core/_methods.py:204: RuntimeWarning: overflow encountered in reduce
  ret = umr_sum(x, axis, dtype, out, keepdims=keepdims, where=where)
[I 2025-07-10 22:47:56,015] Trial 37 finished with value: 0.6200942490211502 and parameters: {'n_components': 2, 'scaler_type': 'PowerTransformer'}. Best is trial 21 with value: 0.6200942490470971.
/home/garrett_reinhard_afrl_af_mil/miniconda3/envs/Ising/lib/python3.13/site-packages/numpy/_core/_methods.py:193: RuntimeWarning: overflow encountered in multiply
  x = um.multiply(x, x, out=x)
/home/garrett_reinhard_afrl_af_mil/miniconda3/envs/Ising/lib/python3.13/site-packages/numpy/_core/_methods.py:204: RuntimeWarning: overflow encountered in reduce
  ret = umr_sum(x, axis, dtype, out, keepdims=keepdims, where=where)
[I 2025-07-10 22:48:15,071] Trial 38 finished with value: 0.5336266785522866 and parameters: {'n_components': 4, 'scaler_type': 'PowerTransformer'}. Best is trial 21 with value: 0.6200942490470971.
/home/garrett_reinhard_afrl_af_mil/miniconda3/envs/Ising/lib/python3.13/site-packages/numpy/_core/_methods.py:193: RuntimeWarning: overflow encountered in multiply
  x = um.multiply(x, x, out=x)
/home/garrett_reinhard_afrl_af_mil/miniconda3/envs/Ising/lib/python3.13/site-packages/numpy/_core/_methods.py:204: RuntimeWarning: overflow encountered in reduce
  ret = umr_sum(x, axis, dtype, out, keepdims=keepdims, where=where)
[I 2025-07-10 22:48:34,180] Trial 39 finished with value: 0.5643955590708332 and parameters: {'n_components': 3, 'scaler_type': 'PowerTransformer'}. Best is trial 21 with value: 0.6200942490470971.
[I 2025-07-10 22:48:48,105] Trial 40 finished with value: 0.6062681177909515 and parameters: {'n_components': 2, 'scaler_type': 'MinMaxScaler'}. Best is trial 21 with value: 0.6200942490470971.
/home/garrett_reinhard_afrl_af_mil/miniconda3/envs/Ising/lib/python3.13/site-packages/numpy/_core/_methods.py:193: RuntimeWarning: overflow encountered in multiply
  x = um.multiply(x, x, out=x)
/home/garrett_reinhard_afrl_af_mil/miniconda3/envs/Ising/lib/python3.13/site-packages/numpy/_core/_methods.py:204: RuntimeWarning: overflow encountered in reduce
  ret = umr_sum(x, axis, dtype, out, keepdims=keepdims, where=where)
[I 2025-07-10 22:49:07,107] Trial 41 finished with value: 0.6200942489955028 and parameters: {'n_components': 2, 'scaler_type': 'PowerTransformer'}. Best is trial 21 with value: 0.6200942490470971.
/home/garrett_reinhard_afrl_af_mil/miniconda3/envs/Ising/lib/python3.13/site-packages/numpy/_core/_methods.py:193: RuntimeWarning: overflow encountered in multiply
  x = um.multiply(x, x, out=x)
/home/garrett_reinhard_afrl_af_mil/miniconda3/envs/Ising/lib/python3.13/site-packages/numpy/_core/_methods.py:204: RuntimeWarning: overflow encountered in reduce
  ret = umr_sum(x, axis, dtype, out, keepdims=keepdims, where=where)
[I 2025-07-10 22:49:26,120] Trial 42 finished with value: 0.6200942489979034 and parameters: {'n_components': 2, 'scaler_type': 'PowerTransformer'}. Best is trial 21 with value: 0.6200942490470971.
[I 2025-07-10 22:49:41,415] Trial 43 finished with value: 0.6673929102239663 and parameters: {'n_components': 2, 'scaler_type': 'RobustScaler'}. Best is trial 43 with value: 0.6673929102239663.
[I 2025-07-10 22:49:56,570] Trial 44 finished with value: 0.6020430110671862 and parameters: {'n_components': 3, 'scaler_type': 'RobustScaler'}. Best is trial 43 with value: 0.6673929102239663.
[I 2025-07-10 22:50:11,808] Trial 45 finished with value: 0.6673929102325815 and parameters: {'n_components': 2, 'scaler_type': 'RobustScaler'}. Best is trial 45 with value: 0.6673929102325815.
[I 2025-07-10 22:50:26,998] Trial 46 finished with value: 0.6673929102226179 and parameters: {'n_components': 2, 'scaler_type': 'RobustScaler'}. Best is trial 45 with value: 0.6673929102325815.
[I 2025-07-10 22:50:42,168] Trial 47 finished with value: 0.6673929102320892 and parameters: {'n_components': 2, 'scaler_type': 'RobustScaler'}. Best is trial 45 with value: 0.6673929102325815.
[I 2025-07-10 22:50:57,293] Trial 48 finished with value: 0.6020430111694502 and parameters: {'n_components': 3, 'scaler_type': 'RobustScaler'}. Best is trial 45 with value: 0.6673929102325815.
[I 2025-07-10 22:51:12,577] Trial 49 finished with value: 0.5551940356606094 and parameters: {'n_components': 5, 'scaler_type': 'RobustScaler'}. Best is trial 45 with value: 0.6673929102325815.
[I 2025-07-10 22:51:27,821] Trial 50 finished with value: 0.6673929102208355 and parameters: {'n_components': 2, 'scaler_type': 'RobustScaler'}. Best is trial 45 with value: 0.6673929102325815.
[I 2025-07-10 22:51:43,004] Trial 51 finished with value: 0.6673929102309862 and parameters: {'n_components': 2, 'scaler_type': 'RobustScaler'}. Best is trial 45 with value: 0.6673929102325815.
[I 2025-07-10 22:51:58,230] Trial 52 finished with value: 0.6673929102160269 and parameters: {'n_components': 2, 'scaler_type': 'RobustScaler'}. Best is trial 45 with value: 0.6673929102325815.
[I 2025-07-10 22:52:13,468] Trial 53 finished with value: 0.6673929102179074 and parameters: {'n_components': 2, 'scaler_type': 'RobustScaler'}. Best is trial 45 with value: 0.6673929102325815.
[I 2025-07-10 22:52:28,749] Trial 54 finished with value: 0.6673929102173837 and parameters: {'n_components': 2, 'scaler_type': 'RobustScaler'}. Best is trial 45 with value: 0.6673929102325815.
[I 2025-07-10 22:52:44,113] Trial 55 finished with value: 0.6673929101946637 and parameters: {'n_components': 2, 'scaler_type': 'RobustScaler'}. Best is trial 45 with value: 0.6673929102325815.
[I 2025-07-10 22:52:59,371] Trial 56 finished with value: 0.6673929102583063 and parameters: {'n_components': 2, 'scaler_type': 'RobustScaler'}. Best is trial 56 with value: 0.6673929102583063.
[I 2025-07-10 22:53:14,662] Trial 57 finished with value: 0.6020430111004014 and parameters: {'n_components': 3, 'scaler_type': 'RobustScaler'}. Best is trial 56 with value: 0.6673929102583063.
[I 2025-07-10 22:53:29,705] Trial 58 finished with value: 0.6673929102263434 and parameters: {'n_components': 2, 'scaler_type': 'RobustScaler'}. Best is trial 56 with value: 0.6673929102583063.
[I 2025-07-10 22:53:45,100] Trial 59 finished with value: 0.6673929102172166 and parameters: {'n_components': 2, 'scaler_type': 'RobustScaler'}. Best is trial 56 with value: 0.6673929102583063.
[I 2025-07-10 22:54:00,322] Trial 60 finished with value: 0.602043011159783 and parameters: {'n_components': 3, 'scaler_type': 'RobustScaler'}. Best is trial 56 with value: 0.6673929102583063.
