[I 2025-07-10 22:54:15,412] Trial 61 finished with value: 0.6673929102285965 and parameters: {'n_components': 2, 'scaler_type': 'RobustScaler'}. Best is trial 56 with value: 0.6673929102583063.
[I 2025-07-10 22:54:30,510] Trial 62 finished with value: 0.6673929102199684 and parameters: {'n_components': 2, 'scaler_type': 'RobustScaler'}. Best is trial 56 with value: 0.6673929102583063.
[I 2025-07-10 22:54:45,725] Trial 63 finished with value: 0.6673929102230505 and parameters: {'n_components': 2, 'scaler_type': 'RobustScaler'}. Best is trial 56 with value: 0.6673929102583063.
[I 2025-07-10 22:55:00,905] Trial 64 finished with value: 0.5399692677103359 and parameters: {'n_components': 6, 'scaler_type': 'RobustScaler'}. Best is trial 56 with value: 0.6673929102583063.
[I 2025-07-10 22:55:14,995] Trial 65 finished with value: 0.6062681177905594 and parameters: {'n_components': 2, 'scaler_type': 'MaxAbsScaler'}. Best is trial 56 with value: 0.6673929102583063.
[I 2025-07-10 22:55:28,938] Trial 66 finished with value: 0.6062681177907996 and parameters: {'n_components': 2, 'scaler_type': 'MinMaxScaler'}. Best is trial 56 with value: 0.6673929102583063.
[I 2025-07-10 22:55:44,492] Trial 67 finished with value: 0.6673929102186852 and parameters: {'n_components': 2, 'scaler_type': 'RobustScaler'}. Best is trial 56 with value: 0.6673929102583063.
[I 2025-07-10 22:55:59,797] Trial 68 finished with value: 0.6673929101967115 and parameters: {'n_components': 2, 'scaler_type': 'RobustScaler'}. Best is trial 56 with value: 0.6673929102583063.
[I 2025-07-10 22:56:14,961] Trial 69 finished with value: 0.6673929102104641 and parameters: {'n_components': 2, 'scaler_type': 'RobustScaler'}. Best is trial 56 with value: 0.6673929102583063.
[I 2025-07-10 22:56:30,261] Trial 70 finished with value: 0.6673929102186392 and parameters: {'n_components': 2, 'scaler_type': 'RobustScaler'}. Best is trial 56 with value: 0.6673929102583063.
[I 2025-07-10 22:56:45,595] Trial 71 finished with value: 0.6673929102211326 and parameters: {'n_components': 2, 'scaler_type': 'RobustScaler'}. Best is trial 56 with value: 0.6673929102583063.
[I 2025-07-10 22:57:00,595] Trial 72 finished with value: 0.6673929102283608 and parameters: {'n_components': 2, 'scaler_type': 'RobustScaler'}. Best is trial 56 with value: 0.6673929102583063.
[I 2025-07-10 22:57:15,723] Trial 73 finished with value: 0.6673929102264583 and parameters: {'n_components': 2, 'scaler_type': 'RobustScaler'}. Best is trial 56 with value: 0.6673929102583063.
[I 2025-07-10 22:57:30,834] Trial 74 finished with value: 0.6673929101868376 and parameters: {'n_components': 2, 'scaler_type': 'RobustScaler'}. Best is trial 56 with value: 0.6673929102583063.
[I 2025-07-10 22:57:47,095] A new study created in memory with name: pca_kmeans_optimization
[I 2025-07-10 22:58:00,851] Trial 0 finished with value: 0.5840687673720809 and parameters: {'n_components': 4, 'scaler_type': 'MaxAbsScaler'}. Best is trial 0 with value: 0.5840687673720809.
/home/garrett_reinhard_afrl_af_mil/miniconda3/envs/Ising/lib/python3.13/site-packages/numpy/_core/_methods.py:193: RuntimeWarning: overflow encountered in multiply
  x = um.multiply(x, x, out=x)
/home/garrett_reinhard_afrl_af_mil/miniconda3/envs/Ising/lib/python3.13/site-packages/numpy/_core/_methods.py:204: RuntimeWarning: overflow encountered in reduce
  ret = umr_sum(x, axis, dtype, out, keepdims=keepdims, where=where)
[I 2025-07-10 22:58:19,602] Trial 1 finished with value: 0.5666197588967797 and parameters: {'n_components': 3, 'scaler_type': 'PowerTransformer'}. Best is trial 0 with value: 0.5840687673720809.
[I 2025-07-10 22:58:33,397] Trial 2 finished with value: 0.647348809653804 and parameters: {'n_components': 2, 'scaler_type': 'MaxAbsScaler'}. Best is trial 2 with value: 0.647348809653804.
/home/garrett_reinhard_afrl_af_mil/miniconda3/envs/Ising/lib/python3.13/site-packages/numpy/_core/_methods.py:193: RuntimeWarning: overflow encountered in multiply
  x = um.multiply(x, x, out=x)
/home/garrett_reinhard_afrl_af_mil/miniconda3/envs/Ising/lib/python3.13/site-packages/numpy/_core/_methods.py:204: RuntimeWarning: overflow encountered in reduce
  ret = umr_sum(x, axis, dtype, out, keepdims=keepdims, where=where)
[I 2025-07-10 22:58:52,015] Trial 3 finished with value: 0.49816624875308196 and parameters: {'n_components': 6, 'scaler_type': 'PowerTransformer'}. Best is trial 2 with value: 0.647348809653804.
[I 2025-07-10 22:59:07,061] Trial 4 finished with value: 0.4928498607699781 and parameters: {'n_components': 4, 'scaler_type': 'RobustScaler'}. Best is trial 2 with value: 0.647348809653804.
[I 2025-07-10 22:59:20,728] Trial 5 finished with value: 0.5528088676331261 and parameters: {'n_components': 6, 'scaler_type': 'MinMaxScaler'}. Best is trial 2 with value: 0.647348809653804.
[I 2025-07-10 22:59:34,668] Trial 6 finished with value: 0.5666197581801002 and parameters: {'n_components': 3, 'scaler_type': 'StandardScaler'}. Best is trial 2 with value: 0.647348809653804.
/home/garrett_reinhard_afrl_af_mil/miniconda3/envs/Ising/lib/python3.13/site-packages/numpy/_core/_methods.py:193: RuntimeWarning: overflow encountered in multiply
  x = um.multiply(x, x, out=x)
/home/garrett_reinhard_afrl_af_mil/miniconda3/envs/Ising/lib/python3.13/site-packages/numpy/_core/_methods.py:204: RuntimeWarning: overflow encountered in reduce
  ret = umr_sum(x, axis, dtype, out, keepdims=keepdims, where=where)
[I 2025-07-10 22:59:53,293] Trial 7 finished with value: 0.5666197590368536 and parameters: {'n_components': 3, 'scaler_type': 'PowerTransformer'}. Best is trial 2 with value: 0.647348809653804.
[I 2025-07-10 23:00:08,439] Trial 8 finished with value: 0.5219176129726726 and parameters: {'n_components': 3, 'scaler_type': 'RobustScaler'}. Best is trial 2 with value: 0.647348809653804.
[I 2025-07-10 23:00:22,230] Trial 9 finished with value: 0.610810345337419 and parameters: {'n_components': 3, 'scaler_type': 'MinMaxScaler'}. Best is trial 2 with value: 0.647348809653804.
[I 2025-07-10 23:00:36,132] Trial 10 finished with value: 0.6473488096537827 and parameters: {'n_components': 2, 'scaler_type': 'MaxAbsScaler'}. Best is trial 2 with value: 0.647348809653804.
[I 2025-07-10 23:00:50,001] Trial 11 finished with value: 0.6473488096537592 and parameters: {'n_components': 2, 'scaler_type': 'MaxAbsScaler'}. Best is trial 2 with value: 0.647348809653804.
[I 2025-07-10 23:01:03,780] Trial 12 finished with value: 0.6473488096537768 and parameters: {'n_components': 2, 'scaler_type': 'MaxAbsScaler'}. Best is trial 2 with value: 0.647348809653804.
[I 2025-07-10 23:01:17,604] Trial 13 finished with value: 0.647348809653715 and parameters: {'n_components': 2, 'scaler_type': 'MaxAbsScaler'}. Best is trial 2 with value: 0.647348809653804.
[I 2025-07-10 23:01:31,338] Trial 14 finished with value: 0.5660139126764757 and parameters: {'n_components': 5, 'scaler_type': 'MaxAbsScaler'}. Best is trial 2 with value: 0.647348809653804.
[I 2025-07-10 23:01:45,435] Trial 15 finished with value: 0.607830433917324 and parameters: {'n_components': 2, 'scaler_type': 'StandardScaler'}. Best is trial 2 with value: 0.647348809653804.
[I 2025-07-10 23:01:59,257] Trial 16 finished with value: 0.5660139153260793 and parameters: {'n_components': 5, 'scaler_type': 'MaxAbsScaler'}. Best is trial 2 with value: 0.647348809653804.
[I 2025-07-10 23:02:13,004] Trial 17 finished with value: 0.6473488096537162 and parameters: {'n_components': 2, 'scaler_type': 'MaxAbsScaler'}. Best is trial 2 with value: 0.647348809653804.
[I 2025-07-10 23:02:26,807] Trial 18 finished with value: 0.584068766498097 and parameters: {'n_components': 4, 'scaler_type': 'MaxAbsScaler'}. Best is trial 2 with value: 0.647348809653804.
[I 2025-07-10 23:02:40,596] Trial 19 finished with value: 0.6473488096536621 and parameters: {'n_components': 2, 'scaler_type': 'MinMaxScaler'}. Best is trial 2 with value: 0.647348809653804.
[I 2025-07-10 23:02:54,649] Trial 20 finished with value: 0.538960516051324 and parameters: {'n_components': 4, 'scaler_type': 'StandardScaler'}. Best is trial 2 with value: 0.647348809653804.
[I 2025-07-10 23:03:08,384] Trial 21 finished with value: 0.6473488096538941 and parameters: {'n_components': 2, 'scaler_type': 'MaxAbsScaler'}. Best is trial 21 with value: 0.6473488096538941.
[I 2025-07-10 23:03:22,237] Trial 22 finished with value: 0.647348809653767 and parameters: {'n_components': 2, 'scaler_type': 'MaxAbsScaler'}. Best is trial 21 with value: 0.6473488096538941.
[I 2025-07-10 23:03:36,046] Trial 23 finished with value: 0.6108103453407535 and parameters: {'n_components': 3, 'scaler_type': 'MaxAbsScaler'}. Best is trial 21 with value: 0.6473488096538941.
[I 2025-07-10 23:03:49,772] Trial 24 finished with value: 0.6473488096537696 and parameters: {'n_components': 2, 'scaler_type': 'MaxAbsScaler'}. Best is trial 21 with value: 0.6473488096538941.
[I 2025-07-10 23:04:04,914] Trial 25 finished with value: 0.5219176127857018 and parameters: {'n_components': 3, 'scaler_type': 'RobustScaler'}. Best is trial 21 with value: 0.6473488096538941.
[I 2025-07-10 23:04:18,694] Trial 26 finished with value: 0.6473488096537683 and parameters: {'n_components': 2, 'scaler_type': 'MaxAbsScaler'}. Best is trial 21 with value: 0.6473488096538941.
[I 2025-07-10 23:04:32,573] Trial 27 finished with value: 0.5660139144117947 and parameters: {'n_components': 5, 'scaler_type': 'MaxAbsScaler'}. Best is trial 21 with value: 0.6473488096538941.
[I 2025-07-10 23:04:46,347] Trial 28 finished with value: 0.6108103453588001 and parameters: {'n_components': 3, 'scaler_type': 'MaxAbsScaler'}. Best is trial 21 with value: 0.6473488096538941.
[I 2025-07-10 23:05:00,029] Trial 29 finished with value: 0.6473488096537392 and parameters: {'n_components': 2, 'scaler_type': 'MaxAbsScaler'}. Best is trial 21 with value: 0.6473488096538941.
[I 2025-07-10 23:05:13,749] Trial 30 finished with value: 0.6473488096537092 and parameters: {'n_components': 2, 'scaler_type': 'MinMaxScaler'}. Best is trial 21 with value: 0.6473488096538941.
[I 2025-07-10 23:05:27,642] Trial 31 finished with value: 0.6473488096536436 and parameters: {'n_components': 2, 'scaler_type': 'MaxAbsScaler'}. Best is trial 21 with value: 0.6473488096538941.
[I 2025-07-10 23:05:41,350] Trial 32 finished with value: 0.6473488096537889 and parameters: {'n_components': 2, 'scaler_type': 'MaxAbsScaler'}. Best is trial 21 with value: 0.6473488096538941.
/home/garrett_reinhard_afrl_af_mil/miniconda3/envs/Ising/lib/python3.13/site-packages/numpy/_core/_methods.py:193: RuntimeWarning: overflow encountered in multiply
  x = um.multiply(x, x, out=x)
/home/garrett_reinhard_afrl_af_mil/miniconda3/envs/Ising/lib/python3.13/site-packages/numpy/_core/_methods.py:204: RuntimeWarning: overflow encountered in reduce
  ret = umr_sum(x, axis, dtype, out, keepdims=keepdims, where=where)
[I 2025-07-10 23:05:59,915] Trial 33 finished with value: 0.5666197593070419 and parameters: {'n_components': 3, 'scaler_type': 'PowerTransformer'}. Best is trial 21 with value: 0.6473488096538941.
[I 2025-07-10 23:06:13,669] Trial 34 finished with value: 0.6473488096538366 and parameters: {'n_components': 2, 'scaler_type': 'MaxAbsScaler'}. Best is trial 21 with value: 0.6473488096538941.
[I 2025-07-10 23:06:28,643] Trial 35 finished with value: 0.5343896231912029 and parameters: {'n_components': 2, 'scaler_type': 'RobustScaler'}. Best is trial 21 with value: 0.6473488096538941.
/home/garrett_reinhard_afrl_af_mil/miniconda3/envs/Ising/lib/python3.13/site-packages/numpy/_core/_methods.py:193: RuntimeWarning: overflow encountered in multiply
  x = um.multiply(x, x, out=x)
/home/garrett_reinhard_afrl_af_mil/miniconda3/envs/Ising/lib/python3.13/site-packages/numpy/_core/_methods.py:204: RuntimeWarning: overflow encountered in reduce
  ret = umr_sum(x, axis, dtype, out, keepdims=keepdims, where=where)
[I 2025-07-10 23:06:47,120] Trial 36 finished with value: 0.5666197584811359 and parameters: {'n_components': 3, 'scaler_type': 'PowerTransformer'}. Best is trial 21 with value: 0.6473488096538941.
[I 2025-07-10 23:07:00,956] Trial 37 finished with value: 0.5666197590948024 and parameters: {'n_components': 3, 'scaler_type': 'StandardScaler'}. Best is trial 21 with value: 0.6473488096538941.
[I 2025-07-10 23:07:14,778] Trial 38 finished with value: 0.5840687654088397 and parameters: {'n_components': 4, 'scaler_type': 'MaxAbsScaler'}. Best is trial 21 with value: 0.6473488096538941.
/home/garrett_reinhard_afrl_af_mil/miniconda3/envs/Ising/lib/python3.13/site-packages/numpy/_core/_methods.py:193: RuntimeWarning: overflow encountered in multiply
  x = um.multiply(x, x, out=x)
/home/garrett_reinhard_afrl_af_mil/miniconda3/envs/Ising/lib/python3.13/site-packages/numpy/_core/_methods.py:204: RuntimeWarning: overflow encountered in reduce
  ret = umr_sum(x, axis, dtype, out, keepdims=keepdims, where=where)
[I 2025-07-10 23:07:33,234] Trial 39 finished with value: 0.6078304339523983 and parameters: {'n_components': 2, 'scaler_type': 'PowerTransformer'}. Best is trial 21 with value: 0.6473488096538941.
[I 2025-07-10 23:07:48,264] Trial 40 finished with value: 0.46220623276519507 and parameters: {'n_components': 6, 'scaler_type': 'RobustScaler'}. Best is trial 21 with value: 0.6473488096538941.
[I 2025-07-10 23:08:02,148] Trial 41 finished with value: 0.647348809653681 and parameters: {'n_components': 2, 'scaler_type': 'MaxAbsScaler'}. Best is trial 21 with value: 0.6473488096538941.
[I 2025-07-10 23:08:15,838] Trial 42 finished with value: 0.6473488096536699 and parameters: {'n_components': 2, 'scaler_type': 'MaxAbsScaler'}. Best is trial 21 with value: 0.6473488096538941.
[I 2025-07-10 23:08:29,546] Trial 43 finished with value: 0.6473488096541097 and parameters: {'n_components': 2, 'scaler_type': 'MaxAbsScaler'}. Best is trial 43 with value: 0.6473488096541097.
[I 2025-07-10 23:08:43,260] Trial 44 finished with value: 0.6108103453590059 and parameters: {'n_components': 3, 'scaler_type': 'MaxAbsScaler'}. Best is trial 43 with value: 0.6473488096541097.
[I 2025-07-10 23:08:57,034] Trial 45 finished with value: 0.6473488096536848 and parameters: {'n_components': 2, 'scaler_type': 'MaxAbsScaler'}. Best is trial 43 with value: 0.6473488096541097.
[I 2025-07-10 23:09:10,665] Trial 46 finished with value: 0.6473488096538065 and parameters: {'n_components': 2, 'scaler_type': 'MinMaxScaler'}. Best is trial 43 with value: 0.6473488096541097.
[I 2025-07-10 23:09:24,443] Trial 47 finished with value: 0.6108103453631358 and parameters: {'n_components': 3, 'scaler_type': 'MinMaxScaler'}. Best is trial 43 with value: 0.6473488096541097.
[I 2025-07-10 23:09:38,078] Trial 48 finished with value: 0.6473488096536718 and parameters: {'n_components': 2, 'scaler_type': 'MinMaxScaler'}. Best is trial 43 with value: 0.6473488096541097.
[I 2025-07-10 23:09:51,773] Trial 49 finished with value: 0.6473488096533058 and parameters: {'n_components': 2, 'scaler_type': 'MinMaxScaler'}. Best is trial 43 with value: 0.6473488096541097.
[I 2025-07-10 23:10:05,421] Trial 50 finished with value: 0.610810345373264 and parameters: {'n_components': 3, 'scaler_type': 'MinMaxScaler'}. Best is trial 43 with value: 0.6473488096541097.
[I 2025-07-10 23:10:19,118] Trial 51 finished with value: 0.647348809654149 and parameters: {'n_components': 2, 'scaler_type': 'MaxAbsScaler'}. Best is trial 51 with value: 0.647348809654149.
[I 2025-07-10 23:10:32,947] Trial 52 finished with value: 0.6078304339438662 and parameters: {'n_components': 2, 'scaler_type': 'StandardScaler'}. Best is trial 51 with value: 0.647348809654149.
[I 2025-07-10 23:10:46,613] Trial 53 finished with value: 0.6473488096539277 and parameters: {'n_components': 2, 'scaler_type': 'MaxAbsScaler'}. Best is trial 51 with value: 0.647348809654149.
[I 2025-07-10 23:11:00,314] Trial 54 finished with value: 0.6473488096535177 and parameters: {'n_components': 2, 'scaler_type': 'MaxAbsScaler'}. Best is trial 51 with value: 0.647348809654149.
[I 2025-07-10 23:11:14,070] Trial 55 finished with value: 0.6473488096535871 and parameters: {'n_components': 2, 'scaler_type': 'MaxAbsScaler'}. Best is trial 51 with value: 0.647348809654149.
[I 2025-07-10 23:11:27,768] Trial 56 finished with value: 0.6473488096535366 and parameters: {'n_components': 2, 'scaler_type': 'MinMaxScaler'}. Best is trial 51 with value: 0.647348809654149.
[I 2025-07-10 23:11:41,652] Trial 57 finished with value: 0.6473488096537064 and parameters: {'n_components': 2, 'scaler_type': 'MaxAbsScaler'}. Best is trial 51 with value: 0.647348809654149.
[I 2025-07-10 23:11:55,382] Trial 58 finished with value: 0.6473488096537519 and parameters: {'n_components': 2, 'scaler_type': 'MaxAbsScaler'}. Best is trial 51 with value: 0.647348809654149.
[I 2025-07-10 23:12:10,487] Trial 59 finished with value: 0.47416300523094546 and parameters: {'n_components': 5, 'scaler_type': 'RobustScaler'}. Best is trial 51 with value: 0.647348809654149.
[I 2025-07-10 23:12:24,193] Trial 60 finished with value: 0.6473488096537419 and parameters: {'n_components': 2, 'scaler_type': 'MaxAbsScaler'}. Best is trial 51 with value: 0.647348809654149.
[I 2025-07-10 23:12:37,974] Trial 61 finished with value: 0.6473488096539098 and parameters: {'n_components': 2, 'scaler_type': 'MaxAbsScaler'}. Best is trial 51 with value: 0.647348809654149.
[I 2025-07-10 23:12:51,713] Trial 62 finished with value: 0.6473488096541464 and parameters: {'n_components': 2, 'scaler_type': 'MaxAbsScaler'}. Best is trial 51 with value: 0.647348809654149.
[I 2025-07-10 23:13:05,587] Trial 63 finished with value: 0.6473488096536815 and parameters: {'n_components': 2, 'scaler_type': 'MaxAbsScaler'}. Best is trial 51 with value: 0.647348809654149.
[I 2025-07-10 23:13:19,356] Trial 64 finished with value: 0.6473488096537032 and parameters: {'n_components': 2, 'scaler_type': 'MaxAbsScaler'}. Best is trial 51 with value: 0.647348809654149.
[I 2025-07-10 23:13:33,075] Trial 65 finished with value: 0.6473488096539727 and parameters: {'n_components': 2, 'scaler_type': 'MaxAbsScaler'}. Best is trial 51 with value: 0.647348809654149.
[I 2025-07-10 23:13:46,779] Trial 66 finished with value: 0.6473488096536884 and parameters: {'n_components': 2, 'scaler_type': 'MaxAbsScaler'}. Best is trial 51 with value: 0.647348809654149.
[I 2025-07-10 23:14:00,578] Trial 67 finished with value: 0.6108103453647727 and parameters: {'n_components': 3, 'scaler_type': 'MaxAbsScaler'}. Best is trial 51 with value: 0.647348809654149.
[I 2025-07-10 23:14:14,255] Trial 68 finished with value: 0.6473488096535975 and parameters: {'n_components': 2, 'scaler_type': 'MaxAbsScaler'}. Best is trial 51 with value: 0.647348809654149.
[I 2025-07-10 23:14:28,038] Trial 69 finished with value: 0.6108103453547303 and parameters: {'n_components': 3, 'scaler_type': 'MaxAbsScaler'}. Best is trial 51 with value: 0.647348809654149.
[I 2025-07-10 23:14:41,683] Trial 70 finished with value: 0.6473488096536688 and parameters: {'n_components': 2, 'scaler_type': 'MaxAbsScaler'}. Best is trial 51 with value: 0.647348809654149.
[I 2025-07-10 23:14:55,458] Trial 71 finished with value: 0.6473488096537408 and parameters: {'n_components': 2, 'scaler_type': 'MaxAbsScaler'}. Best is trial 51 with value: 0.647348809654149.
[I 2025-07-10 23:15:09,204] Trial 72 finished with value: 0.6473488096536856 and parameters: {'n_components': 2, 'scaler_type': 'MaxAbsScaler'}. Best is trial 51 with value: 0.647348809654149.
[I 2025-07-10 23:15:22,973] Trial 73 finished with value: 0.6473488096536483 and parameters: {'n_components': 2, 'scaler_type': 'MaxAbsScaler'}. Best is trial 51 with value: 0.647348809654149.
/home/garrett_reinhard_afrl_af_mil/miniconda3/envs/Ising/lib/python3.13/site-packages/numpy/_core/_methods.py:193: RuntimeWarning: overflow encountered in multiply
  x = um.multiply(x, x, out=x)
/home/garrett_reinhard_afrl_af_mil/miniconda3/envs/Ising/lib/python3.13/site-packages/numpy/_core/_methods.py:204: RuntimeWarning: overflow encountered in reduce
  ret = umr_sum(x, axis, dtype, out, keepdims=keepdims, where=where)
[I 2025-07-10 23:15:41,403] Trial 74 finished with value: 0.6078304339508752 and parameters: {'n_components': 2, 'scaler_type': 'PowerTransformer'}. Best is trial 51 with value: 0.647348809654149.
Starting PCA and KMeans hyperparameter optimization
Optimization finished.
Starting PCA and KMeans hyperparameter optimization
Optimization finished.
Starting PCA and KMeans hyperparameter optimization
Optimization finished.
Starting PCA and KMeans hyperparameter optimization
Optimization finished.
Starting PCA and KMeans hyperparameter optimization
Optimization finished.
Starting PCA and KMeans hyperparameter optimization
Optimization finished.
