[I 2025-07-10 21:47:59,393] Trial 30 finished with value: 0.6171573436803751 and parameters: {'n_components': 2, 'scaler_type': 'MinMaxScaler'}. Best is trial 5 with value: 0.6171573436959582.
[I 2025-07-10 21:48:13,185] Trial 31 finished with value: 0.6171573437088284 and parameters: {'n_components': 2, 'scaler_type': 'MinMaxScaler'}. Best is trial 31 with value: 0.6171573437088284.
[I 2025-07-10 21:48:27,059] Trial 32 finished with value: 0.6171573436990673 and parameters: {'n_components': 2, 'scaler_type': 'MinMaxScaler'}. Best is trial 31 with value: 0.6171573437088284.
[I 2025-07-10 21:48:40,883] Trial 33 finished with value: 0.5684707588952546 and parameters: {'n_components': 3, 'scaler_type': 'MinMaxScaler'}. Best is trial 31 with value: 0.6171573437088284.
/home/garrett_reinhard_afrl_af_mil/miniconda3/envs/Ising/lib/python3.13/site-packages/numpy/_core/_methods.py:193: RuntimeWarning: overflow encountered in multiply
  x = um.multiply(x, x, out=x)
/home/garrett_reinhard_afrl_af_mil/miniconda3/envs/Ising/lib/python3.13/site-packages/numpy/_core/_methods.py:204: RuntimeWarning: overflow encountered in reduce
  ret = umr_sum(x, axis, dtype, out, keepdims=keepdims, where=where)
[I 2025-07-10 21:49:13,685] Trial 34 finished with value: 0.5835419674798779 and parameters: {'n_components': 2, 'scaler_type': 'PowerTransformer'}. Best is trial 31 with value: 0.6171573437088284.
[I 2025-07-10 21:49:27,553] Trial 35 finished with value: 0.5684707606623915 and parameters: {'n_components': 3, 'scaler_type': 'MinMaxScaler'}. Best is trial 31 with value: 0.6171573437088284.
/home/garrett_reinhard_afrl_af_mil/miniconda3/envs/Ising/lib/python3.13/site-packages/numpy/_core/_methods.py:193: RuntimeWarning: overflow encountered in multiply
  x = um.multiply(x, x, out=x)
/home/garrett_reinhard_afrl_af_mil/miniconda3/envs/Ising/lib/python3.13/site-packages/numpy/_core/_methods.py:204: RuntimeWarning: overflow encountered in reduce
  ret = umr_sum(x, axis, dtype, out, keepdims=keepdims, where=where)
[I 2025-07-10 21:50:00,474] Trial 36 finished with value: 0.5835419671782113 and parameters: {'n_components': 2, 'scaler_type': 'PowerTransformer'}. Best is trial 31 with value: 0.6171573437088284.
[I 2025-07-10 21:50:14,322] Trial 37 finished with value: 0.4884409298295665 and parameters: {'n_components': 6, 'scaler_type': 'MaxAbsScaler'}. Best is trial 31 with value: 0.6171573437088284.
[I 2025-07-10 21:50:28,145] Trial 38 finished with value: 0.6171573436377551 and parameters: {'n_components': 2, 'scaler_type': 'MinMaxScaler'}. Best is trial 31 with value: 0.6171573437088284.
[I 2025-07-10 21:50:43,281] Trial 39 finished with value: 0.4225900153189407 and parameters: {'n_components': 5, 'scaler_type': 'RobustScaler'}. Best is trial 31 with value: 0.6171573437088284.
[I 2025-07-10 21:50:57,065] Trial 40 finished with value: 0.5684707606517436 and parameters: {'n_components': 3, 'scaler_type': 'MinMaxScaler'}. Best is trial 31 with value: 0.6171573437088284.
[I 2025-07-10 21:51:10,896] Trial 41 finished with value: 0.6171573436924731 and parameters: {'n_components': 2, 'scaler_type': 'MinMaxScaler'}. Best is trial 31 with value: 0.6171573437088284.
[I 2025-07-10 21:51:24,690] Trial 42 finished with value: 0.6171573436382567 and parameters: {'n_components': 2, 'scaler_type': 'MinMaxScaler'}. Best is trial 31 with value: 0.6171573437088284.
[I 2025-07-10 21:51:38,529] Trial 43 finished with value: 0.6171573438218768 and parameters: {'n_components': 2, 'scaler_type': 'MinMaxScaler'}. Best is trial 43 with value: 0.6171573438218768.
[I 2025-07-10 21:51:52,311] Trial 44 finished with value: 0.6171573437175786 and parameters: {'n_components': 2, 'scaler_type': 'MinMaxScaler'}. Best is trial 43 with value: 0.6171573438218768.
/home/garrett_reinhard_afrl_af_mil/miniconda3/envs/Ising/lib/python3.13/site-packages/numpy/_core/_methods.py:193: RuntimeWarning: overflow encountered in multiply
  x = um.multiply(x, x, out=x)
/home/garrett_reinhard_afrl_af_mil/miniconda3/envs/Ising/lib/python3.13/site-packages/numpy/_core/_methods.py:204: RuntimeWarning: overflow encountered in reduce
  ret = umr_sum(x, axis, dtype, out, keepdims=keepdims, where=where)
[I 2025-07-10 21:52:25,373] Trial 45 finished with value: 0.5835419668645234 and parameters: {'n_components': 2, 'scaler_type': 'PowerTransformer'}. Best is trial 43 with value: 0.6171573438218768.
[I 2025-07-10 21:52:39,184] Trial 46 finished with value: 0.5684707609321431 and parameters: {'n_components': 3, 'scaler_type': 'MinMaxScaler'}. Best is trial 43 with value: 0.6171573438218768.
[I 2025-07-10 21:52:53,027] Trial 47 finished with value: 0.6171573436522865 and parameters: {'n_components': 2, 'scaler_type': 'MinMaxScaler'}. Best is trial 43 with value: 0.6171573438218768.
[I 2025-07-10 21:53:06,892] Trial 48 finished with value: 0.5420228365388784 and parameters: {'n_components': 4, 'scaler_type': 'MaxAbsScaler'}. Best is trial 43 with value: 0.6171573438218768.
[I 2025-07-10 21:53:20,819] Trial 49 finished with value: 0.583541967375397 and parameters: {'n_components': 2, 'scaler_type': 'StandardScaler'}. Best is trial 43 with value: 0.6171573438218768.
[I 2025-07-10 21:53:34,819] Trial 50 finished with value: 0.5684707606298065 and parameters: {'n_components': 3, 'scaler_type': 'MinMaxScaler'}. Best is trial 43 with value: 0.6171573438218768.
[I 2025-07-10 21:53:48,629] Trial 51 finished with value: 0.6171573436468407 and parameters: {'n_components': 2, 'scaler_type': 'MinMaxScaler'}. Best is trial 43 with value: 0.6171573438218768.
[I 2025-07-10 21:54:02,453] Trial 52 finished with value: 0.6171573439144038 and parameters: {'n_components': 2, 'scaler_type': 'MinMaxScaler'}. Best is trial 52 with value: 0.6171573439144038.
[I 2025-07-10 21:54:16,219] Trial 53 finished with value: 0.6171573437024449 and parameters: {'n_components': 2, 'scaler_type': 'MinMaxScaler'}. Best is trial 52 with value: 0.6171573439144038.
[I 2025-07-10 21:54:30,010] Trial 54 finished with value: 0.6171573437020604 and parameters: {'n_components': 2, 'scaler_type': 'MinMaxScaler'}. Best is trial 52 with value: 0.6171573439144038.
[I 2025-07-10 21:54:43,819] Trial 55 finished with value: 0.6171573436917828 and parameters: {'n_components': 2, 'scaler_type': 'MinMaxScaler'}. Best is trial 52 with value: 0.6171573439144038.
[I 2025-07-10 21:54:57,666] Trial 56 finished with value: 0.6171573437642973 and parameters: {'n_components': 2, 'scaler_type': 'MinMaxScaler'}. Best is trial 52 with value: 0.6171573439144038.
[I 2025-07-10 21:55:11,422] Trial 57 finished with value: 0.6171573436841638 and parameters: {'n_components': 2, 'scaler_type': 'MinMaxScaler'}. Best is trial 52 with value: 0.6171573439144038.
[I 2025-07-10 21:55:26,538] Trial 58 finished with value: 0.5116365521116134 and parameters: {'n_components': 3, 'scaler_type': 'RobustScaler'}. Best is trial 52 with value: 0.6171573439144038.
[I 2025-07-10 21:55:40,472] Trial 59 finished with value: 0.5835419674973413 and parameters: {'n_components': 2, 'scaler_type': 'StandardScaler'}. Best is trial 52 with value: 0.6171573439144038.
[I 2025-07-10 21:55:55,073] Trial 60 finished with value: 0.6171573437927508 and parameters: {'n_components': 2, 'scaler_type': 'MinMaxScaler'}. Best is trial 52 with value: 0.6171573439144038.
[I 2025-07-10 21:56:09,229] Trial 61 finished with value: 0.6171573436737235 and parameters: {'n_components': 2, 'scaler_type': 'MinMaxScaler'}. Best is trial 52 with value: 0.6171573439144038.
[I 2025-07-10 21:56:23,250] Trial 62 finished with value: 0.6171573436463379 and parameters: {'n_components': 2, 'scaler_type': 'MinMaxScaler'}. Best is trial 52 with value: 0.6171573439144038.
[I 2025-07-10 21:56:37,254] Trial 63 finished with value: 0.6171573437438094 and parameters: {'n_components': 2, 'scaler_type': 'MinMaxScaler'}. Best is trial 52 with value: 0.6171573439144038.
[I 2025-07-10 21:56:51,225] Trial 64 finished with value: 0.6171573437204063 and parameters: {'n_components': 2, 'scaler_type': 'MinMaxScaler'}. Best is trial 52 with value: 0.6171573439144038.
[I 2025-07-10 21:57:05,257] Trial 65 finished with value: 0.617157343688231 and parameters: {'n_components': 2, 'scaler_type': 'MinMaxScaler'}. Best is trial 52 with value: 0.6171573439144038.
[I 2025-07-10 21:57:19,468] Trial 66 finished with value: 0.6171573436877954 and parameters: {'n_components': 2, 'scaler_type': 'MinMaxScaler'}. Best is trial 52 with value: 0.6171573439144038.
/home/garrett_reinhard_afrl_af_mil/miniconda3/envs/Ising/lib/python3.13/site-packages/numpy/_core/_methods.py:193: RuntimeWarning: overflow encountered in multiply
  x = um.multiply(x, x, out=x)
/home/garrett_reinhard_afrl_af_mil/miniconda3/envs/Ising/lib/python3.13/site-packages/numpy/_core/_methods.py:204: RuntimeWarning: overflow encountered in reduce
  ret = umr_sum(x, axis, dtype, out, keepdims=keepdims, where=where)
[I 2025-07-10 21:57:52,812] Trial 67 finished with value: 0.5835419672420532 and parameters: {'n_components': 2, 'scaler_type': 'PowerTransformer'}. Best is trial 52 with value: 0.6171573439144038.
[I 2025-07-10 21:58:06,839] Trial 68 finished with value: 0.5684707606704013 and parameters: {'n_components': 3, 'scaler_type': 'MaxAbsScaler'}. Best is trial 52 with value: 0.6171573439144038.
[I 2025-07-10 21:58:20,954] Trial 69 finished with value: 0.6171573436695584 and parameters: {'n_components': 2, 'scaler_type': 'MinMaxScaler'}. Best is trial 52 with value: 0.6171573439144038.
[I 2025-07-10 21:58:35,028] Trial 70 finished with value: 0.6171573437435667 and parameters: {'n_components': 2, 'scaler_type': 'MinMaxScaler'}. Best is trial 52 with value: 0.6171573439144038.
[I 2025-07-10 21:58:49,045] Trial 71 finished with value: 0.6171573436588488 and parameters: {'n_components': 2, 'scaler_type': 'MinMaxScaler'}. Best is trial 52 with value: 0.6171573439144038.
[I 2025-07-10 21:59:03,086] Trial 72 finished with value: 0.6171573437212841 and parameters: {'n_components': 2, 'scaler_type': 'MinMaxScaler'}. Best is trial 52 with value: 0.6171573439144038.
[I 2025-07-10 21:59:17,041] Trial 73 finished with value: 0.6171573436978922 and parameters: {'n_components': 2, 'scaler_type': 'MinMaxScaler'}. Best is trial 52 with value: 0.6171573439144038.
[I 2025-07-10 21:59:31,082] Trial 74 finished with value: 0.6171573437274003 and parameters: {'n_components': 2, 'scaler_type': 'MinMaxScaler'}. Best is trial 52 with value: 0.6171573439144038.
[I 2025-07-10 21:59:45,870] A new study created in memory with name: pca_kmeans_optimization
/home/garrett_reinhard_afrl_af_mil/miniconda3/envs/Ising/lib/python3.13/site-packages/numpy/_core/_methods.py:193: RuntimeWarning: overflow encountered in multiply
  x = um.multiply(x, x, out=x)
/home/garrett_reinhard_afrl_af_mil/miniconda3/envs/Ising/lib/python3.13/site-packages/numpy/_core/_methods.py:204: RuntimeWarning: overflow encountered in reduce
  ret = umr_sum(x, axis, dtype, out, keepdims=keepdims, where=where)
[I 2025-07-10 22:00:06,901] Trial 0 finished with value: 0.5580444379697926 and parameters: {'n_components': 6, 'scaler_type': 'PowerTransformer'}. Best is trial 0 with value: 0.5580444379697926.
[I 2025-07-10 22:00:22,196] Trial 1 finished with value: 0.625939156576479 and parameters: {'n_components': 5, 'scaler_type': 'RobustScaler'}. Best is trial 1 with value: 0.625939156576479.
[I 2025-07-10 22:00:36,344] Trial 2 finished with value: 0.5737014253067871 and parameters: {'n_components': 2, 'scaler_type': 'MaxAbsScaler'}. Best is trial 1 with value: 0.625939156576479.
/home/garrett_reinhard_afrl_af_mil/miniconda3/envs/Ising/lib/python3.13/site-packages/numpy/_core/_methods.py:193: RuntimeWarning: overflow encountered in multiply
  x = um.multiply(x, x, out=x)
/home/garrett_reinhard_afrl_af_mil/miniconda3/envs/Ising/lib/python3.13/site-packages/numpy/_core/_methods.py:204: RuntimeWarning: overflow encountered in reduce
  ret = umr_sum(x, axis, dtype, out, keepdims=keepdims, where=where)
[I 2025-07-10 22:00:57,408] Trial 3 finished with value: 0.5580447386136345 and parameters: {'n_components': 6, 'scaler_type': 'PowerTransformer'}. Best is trial 1 with value: 0.625939156576479.
[I 2025-07-10 22:01:11,401] Trial 4 finished with value: 0.5125945149205395 and parameters: {'n_components': 6, 'scaler_type': 'MinMaxScaler'}. Best is trial 1 with value: 0.625939156576479.
[I 2025-07-10 22:01:26,872] Trial 5 finished with value: 0.6439538574143412 and parameters: {'n_components': 4, 'scaler_type': 'RobustScaler'}. Best is trial 5 with value: 0.6439538574143412.
/home/garrett_reinhard_afrl_af_mil/miniconda3/envs/Ising/lib/python3.13/site-packages/numpy/_core/_methods.py:193: RuntimeWarning: overflow encountered in multiply
  x = um.multiply(x, x, out=x)
/home/garrett_reinhard_afrl_af_mil/miniconda3/envs/Ising/lib/python3.13/site-packages/numpy/_core/_methods.py:204: RuntimeWarning: overflow encountered in reduce
  ret = umr_sum(x, axis, dtype, out, keepdims=keepdims, where=where)
[I 2025-07-10 22:01:47,791] Trial 6 finished with value: 0.594517673829006 and parameters: {'n_components': 4, 'scaler_type': 'PowerTransformer'}. Best is trial 5 with value: 0.6439538574143412.
[I 2025-07-10 22:02:01,857] Trial 7 finished with value: 0.5430513434756741 and parameters: {'n_components': 4, 'scaler_type': 'MaxAbsScaler'}. Best is trial 5 with value: 0.6439538574143412.
/home/garrett_reinhard_afrl_af_mil/miniconda3/envs/Ising/lib/python3.13/site-packages/numpy/_core/_methods.py:193: RuntimeWarning: overflow encountered in multiply
  x = um.multiply(x, x, out=x)
/home/garrett_reinhard_afrl_af_mil/miniconda3/envs/Ising/lib/python3.13/site-packages/numpy/_core/_methods.py:204: RuntimeWarning: overflow encountered in reduce
  ret = umr_sum(x, axis, dtype, out, keepdims=keepdims, where=where)
[I 2025-07-10 22:02:22,721] Trial 8 finished with value: 0.6130420851788644 and parameters: {'n_components': 3, 'scaler_type': 'PowerTransformer'}. Best is trial 5 with value: 0.6439538574143412.
/home/garrett_reinhard_afrl_af_mil/miniconda3/envs/Ising/lib/python3.13/site-packages/numpy/_core/_methods.py:193: RuntimeWarning: overflow encountered in multiply
  x = um.multiply(x, x, out=x)
/home/garrett_reinhard_afrl_af_mil/miniconda3/envs/Ising/lib/python3.13/site-packages/numpy/_core/_methods.py:204: RuntimeWarning: overflow encountered in reduce
  ret = umr_sum(x, axis, dtype, out, keepdims=keepdims, where=where)
[I 2025-07-10 22:02:43,657] Trial 9 finished with value: 0.6130420849471394 and parameters: {'n_components': 3, 'scaler_type': 'PowerTransformer'}. Best is trial 5 with value: 0.6439538574143412.
[I 2025-07-10 22:02:59,079] Trial 10 finished with value: 0.643953873455881 and parameters: {'n_components': 4, 'scaler_type': 'RobustScaler'}. Best is trial 10 with value: 0.643953873455881.
[I 2025-07-10 22:03:14,667] Trial 11 finished with value: 0.6439538614619307 and parameters: {'n_components': 4, 'scaler_type': 'RobustScaler'}. Best is trial 10 with value: 0.643953873455881.
[I 2025-07-10 22:03:30,005] Trial 12 finished with value: 0.6259391508613154 and parameters: {'n_components': 5, 'scaler_type': 'RobustScaler'}. Best is trial 10 with value: 0.643953873455881.
[I 2025-07-10 22:03:44,222] Trial 13 finished with value: 0.6130420885108484 and parameters: {'n_components': 3, 'scaler_type': 'StandardScaler'}. Best is trial 10 with value: 0.643953873455881.
[I 2025-07-10 22:03:59,533] Trial 14 finished with value: 0.625939161204539 and parameters: {'n_components': 5, 'scaler_type': 'RobustScaler'}. Best is trial 10 with value: 0.643953873455881.
[I 2025-07-10 22:04:14,833] Trial 15 finished with value: 0.705171103882979 and parameters: {'n_components': 2, 'scaler_type': 'RobustScaler'}. Best is trial 15 with value: 0.705171103882979.
[I 2025-07-10 22:04:29,125] Trial 16 finished with value: 0.6456071913240532 and parameters: {'n_components': 2, 'scaler_type': 'StandardScaler'}. Best is trial 15 with value: 0.705171103882979.
[I 2025-07-10 22:04:43,185] Trial 17 finished with value: 0.6456071913094734 and parameters: {'n_components': 2, 'scaler_type': 'StandardScaler'}. Best is trial 15 with value: 0.705171103882979.
[I 2025-07-10 22:04:57,317] Trial 18 finished with value: 0.6456071913242263 and parameters: {'n_components': 2, 'scaler_type': 'StandardScaler'}. Best is trial 15 with value: 0.705171103882979.
[I 2025-07-10 22:05:11,346] Trial 19 finished with value: 0.5737014253073917 and parameters: {'n_components': 2, 'scaler_type': 'MinMaxScaler'}. Best is trial 15 with value: 0.705171103882979.
[I 2025-07-10 22:05:25,534] Trial 20 finished with value: 0.6130420875351503 and parameters: {'n_components': 3, 'scaler_type': 'StandardScaler'}. Best is trial 15 with value: 0.705171103882979.
[I 2025-07-10 22:05:39,683] Trial 21 finished with value: 0.645607191304907 and parameters: {'n_components': 2, 'scaler_type': 'StandardScaler'}. Best is trial 15 with value: 0.705171103882979.
[I 2025-07-10 22:05:53,888] Trial 22 finished with value: 0.6456071913317887 and parameters: {'n_components': 2, 'scaler_type': 'StandardScaler'}. Best is trial 15 with value: 0.705171103882979.
[I 2025-07-10 22:06:08,044] Trial 23 finished with value: 0.6456071913205892 and parameters: {'n_components': 2, 'scaler_type': 'StandardScaler'}. Best is trial 15 with value: 0.705171103882979.
[I 2025-07-10 22:06:22,183] Trial 24 finished with value: 0.6130420848848614 and parameters: {'n_components': 3, 'scaler_type': 'StandardScaler'}. Best is trial 15 with value: 0.705171103882979.
[I 2025-07-10 22:06:36,345] Trial 25 finished with value: 0.6456071913231858 and parameters: {'n_components': 2, 'scaler_type': 'StandardScaler'}. Best is trial 15 with value: 0.705171103882979.
[I 2025-07-10 22:06:50,440] Trial 26 finished with value: 0.5647139490674673 and parameters: {'n_components': 3, 'scaler_type': 'MinMaxScaler'}. Best is trial 15 with value: 0.705171103882979.
[I 2025-07-10 22:07:04,435] Trial 27 finished with value: 0.5737014253068 and parameters: {'n_components': 2, 'scaler_type': 'MaxAbsScaler'}. Best is trial 15 with value: 0.705171103882979.
[I 2025-07-10 22:07:18,641] Trial 28 finished with value: 0.6130420855851298 and parameters: {'n_components': 3, 'scaler_type': 'StandardScaler'}. Best is trial 15 with value: 0.705171103882979.
[I 2025-07-10 22:07:32,710] Trial 29 finished with value: 0.6456071913264243 and parameters: {'n_components': 2, 'scaler_type': 'StandardScaler'}. Best is trial 15 with value: 0.705171103882979.
[I 2025-07-10 22:07:48,024] Trial 30 finished with value: 0.7051711038809585 and parameters: {'n_components': 2, 'scaler_type': 'RobustScaler'}. Best is trial 15 with value: 0.705171103882979.
[I 2025-07-10 22:08:03,362] Trial 31 finished with value: 0.705171103879745 and parameters: {'n_components': 2, 'scaler_type': 'RobustScaler'}. Best is trial 15 with value: 0.705171103882979.
[I 2025-07-10 22:08:18,787] Trial 32 finished with value: 0.7051711038802748 and parameters: {'n_components': 2, 'scaler_type': 'RobustScaler'}. Best is trial 15 with value: 0.705171103882979.
[I 2025-07-10 22:08:34,054] Trial 33 finished with value: 0.7051711038766068 and parameters: {'n_components': 2, 'scaler_type': 'RobustScaler'}. Best is trial 15 with value: 0.705171103882979.
[I 2025-07-10 22:08:49,503] Trial 34 finished with value: 0.6725767928684054 and parameters: {'n_components': 3, 'scaler_type': 'RobustScaler'}. Best is trial 15 with value: 0.705171103882979.
[I 2025-07-10 22:09:04,900] Trial 35 finished with value: 0.7051711038806083 and parameters: {'n_components': 2, 'scaler_type': 'RobustScaler'}. Best is trial 15 with value: 0.705171103882979.
[I 2025-07-10 22:09:20,275] Trial 36 finished with value: 0.6725767933029737 and parameters: {'n_components': 3, 'scaler_type': 'RobustScaler'}. Best is trial 15 with value: 0.705171103882979.
[I 2025-07-10 22:09:35,650] Trial 37 finished with value: 0.7051711038809203 and parameters: {'n_components': 2, 'scaler_type': 'RobustScaler'}. Best is trial 15 with value: 0.705171103882979.
[I 2025-07-10 22:09:51,092] Trial 38 finished with value: 0.7051711038801295 and parameters: {'n_components': 2, 'scaler_type': 'RobustScaler'}. Best is trial 15 with value: 0.705171103882979.
[I 2025-07-10 22:10:06,534] Trial 39 finished with value: 0.672576792792486 and parameters: {'n_components': 3, 'scaler_type': 'RobustScaler'}. Best is trial 15 with value: 0.705171103882979.
[I 2025-07-10 22:10:21,851] Trial 40 finished with value: 0.6149793804476223 and parameters: {'n_components': 6, 'scaler_type': 'RobustScaler'}. Best is trial 15 with value: 0.705171103882979.
[I 2025-07-10 22:10:37,217] Trial 41 finished with value: 0.7051711038814384 and parameters: {'n_components': 2, 'scaler_type': 'RobustScaler'}. Best is trial 15 with value: 0.705171103882979.
[I 2025-07-10 22:10:52,522] Trial 42 finished with value: 0.7051711038812539 and parameters: {'n_components': 2, 'scaler_type': 'RobustScaler'}. Best is trial 15 with value: 0.705171103882979.
[I 2025-07-10 22:11:07,823] Trial 43 finished with value: 0.7051711038805002 and parameters: {'n_components': 2, 'scaler_type': 'RobustScaler'}. Best is trial 15 with value: 0.705171103882979.
[I 2025-07-10 22:11:23,045] Trial 44 finished with value: 0.7051711038741495 and parameters: {'n_components': 2, 'scaler_type': 'RobustScaler'}. Best is trial 15 with value: 0.705171103882979.
[I 2025-07-10 22:11:37,114] Trial 45 finished with value: 0.5277466205947468 and parameters: {'n_components': 5, 'scaler_type': 'MaxAbsScaler'}. Best is trial 15 with value: 0.705171103882979.
/home/garrett_reinhard_afrl_af_mil/miniconda3/envs/Ising/lib/python3.13/site-packages/numpy/_core/_methods.py:193: RuntimeWarning: overflow encountered in multiply
  x = um.multiply(x, x, out=x)
/home/garrett_reinhard_afrl_af_mil/miniconda3/envs/Ising/lib/python3.13/site-packages/numpy/_core/_methods.py:204: RuntimeWarning: overflow encountered in reduce
  ret = umr_sum(x, axis, dtype, out, keepdims=keepdims, where=where)
